	transcript_id	group	long_cluster	long_centroid	u_intro	u_basic job description	u_walkthrough	u_project example
95	creativity_0095	Art, design, crafts	1	I do a variety of creative work. I am se	"sounds good, and no, proceed!
"	"I build pedals from scratch. This means I often choose a tried and true circuit and expand upon it or change it some way to make it my own. I then either purchase an enclosure or make it. Then, I make wood faceplate that is slightly smaller than the face of the enclosure, and I stain it and finish it nice and smooth. Then, I apply waterslide decals with graphics I've created and seal them in with more coats of finish. I do all the work myself, including making the PCBs out of stripboard, drilling all my enclosures, and doing all of the soldering and component purchasing myself. I sell them. I make custom ones often, as well, and what started as a hobby quickly grew into a business where I repair electronics faster than they can be picked up by the customers, and I sell so many of my original pedals I rarely have any of my own to play around with. I spend a lot of time on each project; probably more than is necessary. It's impossible, honestly, to get the hours for each pedal down. It's a week at least, with 12-hour days sometimes, and only 4-hour days other times.
"	"Sometimes it's as simple as coming up with new names for controls or effects, but sometimes it's also about understanding parts of a circuit I may not understand correctly. Usually, it's to better understand elements of electrical engineering in which I'm lacking. That said, I'd really like to utilize it for Bill of Materials compilations, circuit theory (testing?), as well as providing me with the best of the abundance of sources for components. Also, awareness of existing circuits. Almost like, a wizard librarian with his eye out for the best price and the most up-to-date info on component availability, and if not, what actually is suitable, including alternate pinouts if applicable, etc.
I feel like I am dyslexic with signal flow, as well as understanding some concepts that might seem basic. In particular, I am developing a synthesizer, and I have a harder time understanding things like when a summing amp is necessary and when it isn't. Or, another example might be discussing diode clipping and cascades...knowledge about what different diode configurations are known to produce is helpful so I know if I'm barking up a tree that's been barked up to much. As far as interactions go...I feel like I get some practical understanding out of the conversation, but my confidence is still kind of low. What if the info is wrong?
"	"A practical example is asking how to get PCB files to order PCBs without the usually necessary gerber file. I have, in the example, a jpg or pdf of a PCB layout, and a complete BOM; how do I proceed? I got stiffed by someone years ago and I'm trying to reverse engineer their work. I have my business name literally copyrighted on the image of the PCB layout...I just don't have the gerber. The instruction was to recreate the layout from scratch, which was ultimately what I had to do, and the resources for that were helpful too. I then kind of proceeded to learn how easy it was to use EasyEDA with AI. It took about a year, but now I'm making them with no problems thanks to that one conversation. It kind of set me off from converting my stripboards to proper PCBs for the final sale models.
"
96	creativity_0096	Fiction writing	0	I'm a writer, primarily of science ficti	"No, thank you, you can proceed.
"	"I'm a writer, novels and also ghost writing blog articles. A typical project for ghost writing is to get a topic, double check the requirements for both the client and if there's any middle management, do the research, and write the article, typically between 500-2000 words, depending. Research usually takes a few hours, and writing usually takes an additional hour. Novels are significantly more involved, as you can imagine. Each novel is different, but a simplified version of a project overview would be to outline, research, create a first draft, edit, research, rewrite, create a second draft, and repeat until something is ready to be handed over to betas. Those are typically on my own timetable, for however long it takes.
"	"Research is the only area I use it heavily, but I will use AI sporadically for another area. For research, AI saves on time significantly by collecting a bunch of sources for me, or helping me hammer out details I either don't understand or have misunderstood. For the other area, I have a writing disability (ironic, I know), and AI helps me when I'm struggling. For example, when I'm struggling with spelling, I'm able to give AI the definition, and it can tell me the word I'm trying to use. Or when I'm trying to find the correct word for something, for example a piece of architecture or an uncommon piece of furniture, when I know what the thing is, but I'm having difficulty communicating it properly. AI is excellent for taking the description and finding the correct words for me.
"	"Currently, I'm working on a novel that takes place in a fantasy world, but set in a time similar to our Roman era in western civilization. So, research has been key on that, making sure it is as authentic as possible. AI in particularly is helpful in that kind of area because not only can it give me sources that are usually fact checked and reliable, but it is also aware of how I'm applying that research (ie, into a fantasy world), and can make note when something might not be very applicable, or when something might be uniquely relevant to my fictional world. As far as how it feels, it feels less stressful to have that kind of research buddy, and its encouragement always helps me not feel discouraged when the research itself isn't turning over what I might have hoped.
"
97	creativity_0097	Content writing	2	I work on writing research style blogs t	"sounds good!
"	"I'm a web developer and software developer, web apps and android apps primarily. A typical project is setting up a business website or a website for one of the apps I'm developing, creating content for it from graphics to blog articles and writing copy that converts lookers into customers.
"	"I rely heavily on AI tools for content creation, a lot of working on the main pages in the site relies on copy that converts and AI helps me A/B test and find something that fits the feel of the site. I use it for programming and occasionally graphics but primarily marketing copy is where I lean heavily on AI.
"	"I used AI most recently to come up with and then refine the landing page copy for a client who runs a tattoo studio. She wanted something that fits her style so I told AI about her and the specific project goals and the task of writing the main copy. I work through it from top to bottom and then go back through again to find weaknesses and identify ways it could be better. It makes me feel a bit more confident in the marketing copy before I hand it over to a client but there are also issues like sounding too cliche or not finding the right tone.
Ok so I start typically with describing the client and goals and such and then ask for the very first line on the website and really refine it before going much further because it sorta sets the tempo. I then go on from there to each individual section whether its telling about features of a SaaS product or describing the tattoo studio or business and who they serve. basically I ask for copy that converts for each section. once I get  something I feel confident with I start a new conversation or choose a new model and send it through and ask for critical feedback pros and cons. I use that feedback as guidance for the replacement text, explaining why I like parts the model picked as not great or highlighting areas I don't like. I then ask for two or three versions depending on how I feel about it. The goal being to find issues before it gets to the client and sometimes I'll use multiple models to bounce ideas around and brainstorm ways to improve it
"
98	creativity_0098	Fiction writing	0	I'm a writer, primarily of science ficti	"That sounds great, no questions yet :)
"	"It is my hobby, and something I spend a lot of time doing, which is researching and writing, about all sorts of topics. A typical project would be anything from a personal interest, or something in current affaris, a philosophy - generally any topic I'm curious about - becoming something I study, almost accademically and then write about. Its a cathartic way of helping me understand myself and the world around me more fully. My neurodiversity has held me back somewhat in the past, but now I'm overcoming those obstacles, I'm re-framing this personal journey as something I can re-orient into creating things to help others like me, get on in the world better. In a sense, give them some of the assistance I could have done with when I was younger.
"	"In the past, due to my ASD, I focused in on a range of topics of interest, researched them, and wrote about them, or produced some guide or flow chart - like a process of helping me understand the world and myself. This was really messy, un-focused, the topics were random and often I didn't finish them. I improved my work flow as an adult, higher education and work experience gave me skills that improved this hobby. It wasn't until AI came along though that I've seen a noticable difference in my output. I can use a range of AI tools now to help me research that save me so much time. Brainstorming ideas, checking for bias, validating information, cross checking data, finding the right words or ways to phrase a concept, untangling metaphore, exploratory thinking, advice... so much more, I could write a lot about how AI fits into my creative process. But to put it simply, it helps me untangle and present all the things I'm curious about in the world, that I think may be of interest or use to others, turning a mess of ideas into something useable.
"	"Yes, as part of my own journey, I'm making moves to improve my health and weight loss is one of the goals. Naturally I need to understand more about health, nutrition, exercise etc to help me lose weight, I can't just pick a diet and follow a schedule, I need to understand whats going on with me physiologiclaly - how ever complex or detailed that is. I never found anyone with the patients to listen to all my questions and go over and over details until they make sense to me, so in terms of how it felt for me - its like having the guide or teacher in my life now that I always needed. This project helped me understand so much more about how my body works. I've been able to probe and query so many things that it would have taken me hours - weeks maybe to research on my own. I feel gratitude, and I'm feeling a sense of acomplishment for what its done for me with this project so far, I'm still in the middle of this one though, so I'm hoping those feelings are magnified again by the end of it.
"
99	creativity_0099	Art, design, crafts	1	I do a variety of creative work. I am se	"That all sounds fine to me
"	"Well, I work in a couple of areas. One is graphic design where I need to create personalised prints and designs, the other is written. The written work is normally a presentation that needs to fit a particular theme or piece of writing. usually religious in nature. It may sometimes be an application for a grant or fund. Research is very important in order to ensure that the written work has integrity. The writing needs to be informative, engaging and connect with people in a way that hopefully leaves them feeling changed in some way.
"	"I still feel that AI is lacking a bit for the visual process, it appears to struggle when it comes to using fonts and writing. It's really helpful for the writing process. I can use it to give me inspiration. For example providing an idea, theme or piece of writing to the model, it often then provides some insights or thoughts. It's particularly helpful to bounce ideas off, check if certain thoughts or insights are factually accurate, or to help build on ideas. Sometimes, if I have a bit of a block and I don't know where to go next, I can upload what I have and ask for some ideas for what is is missing from the written piece.
It may be asking about historical context for a piece of writing (particularly religious writing). Often this may lead to asking further questions about specific people, cultures, religions or practices. This all feeds into gaining a deeper understanding of the piece of writing that is being studied. An example of this may be starting with ""give me the historical context of 'passage x'"". The response from the model may lead me on to the follow up question ""Tell me more about y"". Alternatively I may ask the model to rephrase a certain part of my writing to make it clearer, or ask if what I have included in my writing is factually accurate.
"	"A recent project began with my question ""why did Paul feel the need to write these words to the church in Thessaloniki 'make it your ambition to lead a quiet life: You should mind your own business and work with your hands, just as we told you, 12 so that your daily life may win the respect of outsiders and so that you will not be dependent on anybody.'""  This question began the process for me to understand more of what the passage was trying to say, rather than what may at first appear obvious to a modern day western reader. It helped me to get inside the mind of the author of the text. The information provided helped me to begin to find areas of interest and relevance that I could then hang a presentation on, ensuring that I was not misrepresenting the intended message. It was incredibly helpful. Not only did it help give me a starting point, but it also meant that I had a good amount of evidence and information to support my angle.
"
100	creativity_0100	Audiovisual	4	I'm a musician, so my projects range fro	"Sounds great. Let us begin.
"	"I do acting and comedy and I am involved in a lot of behind the scenes/backstage work as well in both film and theater. A typical project is a gig for me frankly. I am being brought into a team to perform a particular role because of my distinct abilities.
"	"I primarily engage AI tools to help me deal with administrative tasks and paperwork, filling forms when I am applying for jobs, keeping on top of my paperwork for my union membership, tailoring my resume and portfolio, managing my calendar and schedule.
"	"I recently helped to design a set for a comedy video/podcast. I had done some drawings as mock ups to show the client what it would look like, but they were unsatisfied with the work I had done. So I transferred my drawing into a AI and was able to make it into a realistic, 3d image and was able to convince the client and make some important changes. We used that image to run green-screen screen tests and give the client a chance to play in the space and see how it would look on camera before we committed to building the set.  I was frustrated at first with how the AI tool handled rendering my drawing however, the experience helped me to learn how to better prompt the model to get desired results.
It is a rather specific thing, but when you mention to a model to NOT include some element, it would invariably show up. It's like dealing with humans and you tell them to not think of a pink elephant. Do you get my drift? Elements that I didn't want included, I did not even mention. Because for example I would tell it, ""get rid of the bust of Shakespeare""; The bust would appear in every iteration even after explicit requests to remove it.
It was kind of annoying but it is like learning to deal with any other personality. I will admit that I caution a lot of people to be careful and sparing in using AI tools because of this, often they will not get what they want at first because they have not bothered to learn how to prompt engineer and will either become frustrated or end up producing work that is ""good enough"" but contains other flaws or errors that they had not been paying attention to at all.
""short attention span errors"" for example, you generate an image of a waiting room with potted plants. the issue is that they are not real plants and only bear passing resemblance to real potted plants but you'd only notice if you're looking for more than a split second. A lot of people in Comedy generate posters for shows using AI tools to avoid dealing with graphics software like Photoshop or Gimp, but also create posters where the comedian doesn't look anything like their avatar, they have a double headed mic or extra fingers. It look good enough to the user because they had some ideas about what they wanted to see but neglect details that the end user (the people they are trying to convince to come to their show) will see and judge them on. I am sure you know there is a virulent anti AI sentiment in a lot of the creative world.
"
101	creativity_0101	Mix	3	I'm an artist and a writer with a PhD in	"That sounds great, I have no questions!
"	"I am a full time wedding photographer so I use many tools to help me in the various stages of my projects. With my clients, I typically help plan some of their wedding details and do correspondance, which I use AI to help with. Creatively, I get to use AI in a lot of my marketing - like creating content for social media or blogs for my website - and in the post-production process of selecting, editing, and delivering the client's wedding photos.
"	"My job is naturally quite creative since not only it deals with the art of photography, but as an entrepreneur I feel my approach to ""doing business"" is creative. I find I use AI most when I am brainstorming, iterating ideas, trying to communicate to associates and clients, create effective and passive workflows, and especially with marketing. I like to have conversations frequently where I state my objective or intended outcome and then have the AI ask me questions, gain deep knowledge understanding about my approach or perspective, and then help me create the path to obtain my objective. For example, when using AI for creating Instagram content, I will first extensively train the AI on my tone of voice, brand values, mission, objectives, workflows, and more. I typically will say something like ""I need you to help me create my Instagram content for my wedding photography business. I'm trying to reach (this type of person) and get them to (do this thing like book a wedding package). Here's what I want my content to look like or sound like. Here are some difficulties I face."" And then before I let it help me, I tell it to ask me questions to gain better understanding from me of what it may need to accomplish the task. I will do this with other things - such as creating a new client experience or package. Sometimes I will do a similar approach to help me practice sales calls or create a new script.  Really the possibilities here are endless.

I also will use it to edit copy on my website, or to review the copy I have and tell me if it's in a good order for the ""customer journey"" and ask if there's something I can change to have more impact. I like to think of all AI use as a collaboration. I provide the intended outcome and have the AI help me better define that outcome and the supporting details. Then I provide the initial idea or the draft version and then use the AI to help me see my ""blind spots"". I iterate my thoughts about the blind spots it pointed out and then it helps me come up with solutions. I will spend extensive amounts of time on many tasks using AI and think it has improved my quality of output in every way and arena of business. 

I also use tools that are AI powered, but not the typical ""chat bot"" AI. I use programs that will AI select a desired amount of images from 10k images from a wedding for example based on certain qualities I'm looking for. It will select the best of the images, include one of every grouping from family photos, omit everything that has closed eye, or follow the other instructions  given. I use a program that will auto edit all of my images to a certain style that is trained based on my past images. I have a program that delivers the images AI sorted by individual in the images. The longer I think about it the more uses I realize I use AI for.
"	"I am in the process of extending my business to include ""Lifestyle Photography"" which is like family photos. Instead of just integrating it into the current business I have I decided it needs to be it's own standalone thing - really so that my wedding business doesn't become in-cohesive and watered down. In the earliest stages I think AI helped me come to this conclusion when I was confused about how to fuse the two together. But this overhaul that I'm still currently in has required that I look through every corner of my business and convert my business assets (like pdf guides, onboarding documents, contracts, website copy, portfolio blogs, sales scripts) into a version that communicates my lifestyle photography objectives and services. Some of that has been more administrative and editorial in nature, but overall I ""outsource"" a lot of the decision brainstorming and idea creation to AI because it's an overwhelming and idea-heavy process. Since I train my AI chats with things like my mission statement or values or desired outcome, when I present an idea or problem I find that it will consider the impact to that ""bigger vision"" more easily and consistently than I do. When it knows in such detail my entire business or even just my client experience, I find that when I do even really quick chats like ""how should I respond to this email"" it gives a very well considered and thorough answer. But this use of AI for the ""creation"" stages of things provides me so much more freedom to pursue the best ideas well and abandon the not so great ones early.
"
102	creativity_0102	Fiction writing	0	I'm a writer, primarily of science ficti	"No questions, let's begin!
"	"I'm a writer and editor, so my flow varies a lot from project to project, but generally it goes like this:
-I go over the initial version of the project, be it notes I took on a show or movie or a rough draft someone else sends me, like a blog post or a manuscript. I take it in and make any obvious edits, like fixing typos or grammar mistakes, or rephrasing things that don't quite sound right.
-I typically like to wait a while before proceeding with the next step, which is thinking over the whole project and how the major ideas fit together. This often involves me rearranging whole paragraphs, cutting and moving chunks of text, more intricate rephrasing, and sometimes adding headers to break up lengthy web posts. If I'm drafting an original post, it usually looks like me organizing thoughts into distinct categories and then weaving them together so they sound like they flow together naturally. If there are a lot of notes and the thoughts are hard to keep track of, I may color-code them to make it easier. If I'm doing something like editing a manuscript, this is where I might make more overarching story or character notes in the margins as I read.
-The final step is to read the whole thing through again and polish it up, making sure that all my edits flow naturally and make sense, and, if it's not my work, that it still sounds like the original author. If I'm editing a manuscript, this is where I'll type out a letter highlighting what I think are the most crucial areas that need looking at. 
-If I'm editing or writing something for the web, the last step is to go through and do basic SEO edits.
"	"Rarely, if ever, do I use AI in the creative process itself - I enjoy writing and I generating the basics takes the fun out of it for me. What I do use it for is to keep track of character and setting notes in original fiction and when reading complex manuscripts: My notes are often messy and disorganized, and when I was younger I often found myself wishing I could have some sort of Clippy-esque assistant that would just be able to read through my notes and answer any question I had directly. This is especially useful in works with a lot of characters or places to keep track of - doubly so for fictional ones with no other reference material for those things.
"	"I was writing a scene in a fantasy setting that contained dozens of potential character interactions - I'm co-writing a novel with another author in a sort of literary roleplay-type format, so there are a number of potential interactions that could happen at any given time. I was able to use an AI assistant to go through the names and place them in different areas of a large palace ballroom and social scene, and then to move them around naturally as the scene continued. There is no way I could have pulled off the true randomness of the interactions and character groupings without such a tool, and the resulting scenes would not have been nearly as interesting as what we produced.
"
