	transcript_id	group	long_cluster	long_centroid	u_intro	u_basic job description	u_walkthrough	u_project example
24	creativity_0024	Content writing	2	I work on writing research style blogs t	"Sounds good, I'm ready.
"	"I am a writer, a freelance author, editor, and indie publisher. I have written and published a couple of nonfiction books about fibromyalgia on Amazon, and done editing and assisted with publishing on about 5 other books written by other authors. A project I'm currently working on is a devotional intended for people with chronic pain, fibromyalgia, or other chronic illness, focused toward helping them figure out how they function according to God's will for their lives, and it's intended to be the first in a series of devotionals, each one with 40 days or entries, and each one also designed to encourage journaling, so each entry/day will include a journaling prompt at the end, and the print version will have a few pages of ruled paper for journaling after each devotional. I am working right now on the content of the first one, and once I have it finished, arranged, edited, etc, I will design the cover and publish it to Amazon and possibly other avenues, in digital and paperback versions. does that answer sufficiently?
"	"For my writing and publishing, I typically use AI quite a bit in the research phase, especially in searching out bible verses or passages that fit the material/subject matter, and especially finding verses that aren't as commonly used for what I'm writing about. For example, in my current book, Habakkuk is coming into play quite a bit. Then I will sometimes reach out to AI for help if I get stuck during my writing with what to say about something or how to express a particular idea. I tend, in my own words, to get too wordy sometimes, and sometimes I have trouble being direct or efficient in expressing an idea, so I'll use AI to get feedback or ideas on how I can say something. And then in the editing phase, I am an avid proofreader, but I will use AI to double check my work and get final feedback. Also to find things that might not be super obvious, like an extra space where it doesn't belong. I have not previously used it for cover design, but I might end up incorporating some of that going forward.
"	"I haven't had other major projects, because I've been working on the current one off and on for awhile , and have recently dealt with a lot of illness. But I can tell you that kind of a sub-portion of the current project where AI was quite useful was when I needed to figure out how to organize my devotionals for the book. I had all of these devotionals which I had written individually but didn't want to just put them in a random order, or something kind of arbitrary like alphabetical, and I didn't necessarily want to go in biblical order by the passage I used for each one, but something that would be meaningful for the readers. So through discussions with a couple of models I was able to decide on 8 categories, with each one having 4 smaller devotionals, and 1 that was more comprehensive, so that it was essentially 8 sets of 5 devotionals, with each covering an area like accepting your illness or God's path, understanding why God allows illness in His followers and how He uses it, and ways that we can still serve and God can still use us, despite, or even because of, our challenges. That help in coming up with the 8 subdivisions, and especially in organizing the devotionals into categories, was incredibly helpful. I felt overwhelmed going in, but by the end I was very grateful for this new tool.
"
25	creativity_0025	Art, design, crafts	1	I do a variety of creative work. I am se	"Sounds great! No questions!
"	"I do a lot of different creative work. My most recent work has consisted of crocheting neon bucket hats for some teenagers going to a festival. I also do watercolor, macrame, and I write stories and poems. I've also sold furniture I've refurbished among other things.
"	"I don't use AI too often because I really enjoy my creative process, but it as been really helpful for some tasks. I will use it to edit things that I've written or help find a suitable color palette for a painting idea I have. If I get stuck on a macrame knot or crochet stitch it has helped me quicker than searching myself does.
"	"Actually, this is really cool. I saw an image on the internet a couple weeks ago and it instantly inspired me to want to paint something. I uploaded the image to AI and explained my idea for the painting and asked the AI to pull out the colors from the image that I would need and tell me the names. That was very helpful because I didn't have to go through the tedious task of mixing colors and doing a sample sheet to find the perfect shades.
"
26	creativity_0026	Fiction writing	0	I'm a writer, primarily of science ficti	"Sounds good. Go ahead.
"	"I work as a screenwriter for film and television. ""Typical"" varies quite a lot in my line of work. The circumstances around one project are never quite the same. However, you could probably categorise it into three buckets: original writing, rewriting, writing for hire. If I'm doing original writing, I will come up with an idea for a story, determine whether it's best suited to TV or film, then start to ideate on story, characters etc, until I have a sense of the overall plot of the feature or pilot/first season of the TV show. I'll then most likely write it on spec and have my agent send it out, rather than try pitching it out. For rewriting (usually film), I will digest the materials that need work, dissect flaws and strengths, how they can be improved, whether I am the right person to do so, and will then pitch my take on what/how to improve the project to the filmmakers involved. If I get the job, I will then try and execute this take, enhancing the script as a whole along the way, in addition to the specifics in my pitch. Usually, there will be at least one revision step where I can adjust/course-correct/inject further feedback from the filmmakers. In terms of writing for hire, I will be interviewed by show-runners, filmmakers etc. based on the strength of my previous work and then be invited to make suggestions or pitch my take on underlying material or ideas. My job will be to serve whoever is in charge of the creative vision, enabling their intentions and, if given the job, helping to execute this vision.
"	"Usually during my own original writing, particularly at an early ideas stage when outlining, I might use AI to say, ""Give me ten surnames for a man from Barnsbury born in 1971"". Usually, I will not get the ideal response from asking that question, but it will send me on a path towards what I actually want by giving some examples and eliminating what I don't want.
Correct. I have found it most useful as a starting point in my own work, it saves me time from searching for inspiration on a broader canvas and instead delivers more quickly the sort of thing I'm looking for. Sometimes its easier to determine what you don't want than knowing exactly what you do; i.e. you probably have a ball-park idea of what you're looking for, but might not be able to articulate it exactly, a sort of ""know it when I see it"" creative aspect.
"	"I used it for generating character surnames in a feature film I wrote. I also used it as a way of iterating idioms, which where part of a joke in a character's dialogue - the dialogue wasn't sounding quite right, or quite as funny as what I was reaching for. Again, the AI didn't give me something better, but by combining and refining its suggestions I was able to reach something I was happy with.
The back and forth was pretty limited. I asked for iterations based on ""bull in a china shop"", which it listed. I was then able to hone in on ""loose cannon"" asking for more like that. I then asked it to generate examples a few more times before settling on which of the examples I thought was closest to my intention.
"
27	creativity_0027	Art, design, crafts	1	I do a variety of creative work. I am se	"That sounds pretty self-explanatory! Just hope I can answer everything you need to help with your research
"	"So my main business I have that involves creative work is using a Cricut machine to vinyl items such as T-shirts & clothing and also vases, wine bottles, glasses, mugs etc as gifts. I can pretty much vinyl most things including photos.  A typical project to me could be designing a logo for a T-shirt, cutting this into vinyl and then applying it with heat.
"	"Oh it does, it can be so time consuming depending on the design. I have to use a special tool to weed out the vinyl before transferring it. Imagine at Christmas when you have loads to prepare.
I certainly do! I literally get mental block when trying to think of ideas so I use AI to generate these ideas for me, usually Gemini. Gemini will give me design ideas to generate in Cricut and also gift ideas involving vinyl.
"	"Now let me think, I work on so many projects I don't know whether I am coming or going most days!!  The most recent project I can think of was a friend wanted me to make a unique, memoriable gift for their mum who was turning 90 years old. I didn't want it to be the usual cushion or vase so I asked Gemini to provide me with a list of gift ideas to make. The ideas that Gemini came out with I never would have dreamt of in my wildest dreams, they were so thoughtful and out of the box.
To be honest it was a relief and like a weight had lifted off of me. I didn't want to let me friend or her mum down with a rubbish gift idea which would look bad on me but I just could not think of anything. I also had so much going on that, honestly, I just didn't have the time to think either. Gemini saved me time. I felt happy and satisfied if that's how you can describe it I guess. Also optimistic, knowing there was this ability to generate insane ideas to make my business amazing.
"
28	creativity_0028	Fiction writing	0	I'm a writer, primarily of science ficti	"No, all good, please fire away!
"	"So I am an author, to date I have published two novels, both thriller novels with philosophical themes. I am currently writing a fantasy series.
"	"I find that AI is a terrific way of becoming ""unstuck"". If I can give you an example, I required a way of describing an institution somewhat like a bank in a pre-industrial society. The list of suggestions given (I always ask for 10 plus suggestions) essentially rebooted my semantic field and I came up with the perfect description for what I wanted , triggered by the best suggestions. I use AI in this way both with descriptions for concepts (novel or adapted), or sometimes just word choices.
"	"So I've recently been writing a new series called [REDACTED], with the first novel being called [REDACTED]. In addition to using it on a number of occasions as the catalyst as you say for word choices and conception descriptions, I also use it to talk though world-building consequences. For example, the word has two moons, I described their cycles to the model, and used it to determine the frequency of sacred nights on which both moons were full.
"
29	creativity_0029	Art, design, crafts	1	I do a variety of creative work. I am se	"Sounds great! I don't have any questions.
"	"You bet. I design and hand-paint custom shoes for people. A typical project includes planning the shoe design digitally, which is usually what takes longest. Once I have the thumbs up from the customer, I sketch the design onto the shoe. I then use paints and brushes to paint the design onto the shoe, using a matte protectant to seal and protect the design when finished.
"	"I reach to AI quite frequently throughout the process. Sometimes I use it to help me write emails if I am feeling overwhelmed or nervous about certain customers. I use it to help me come up with ideas for what to put where on my shoe designs. I also use it to discuss color combinations and how they would look on certain parts of the shoe. If I'm facing serious artist's block, I'll have it make some designs for me to gain inspiration from. I NEVER copy these designs - they are used strictly to inspire unique ideas for myself. I also ask it for recommendations on different types of paints and sealer, if I'm wanting to switch my materials up a bit.
"	"[REDACTED] Yeah! I recently did a commissioned pair of Attack on Titan shoes. When I started out, I wasn't really sure how I wanted to represent the characters on the shoes. Positioning is super important; the shape of the shoe can really distort characters, if they're not placed right. To help me, I had the model make a few different shoe layouts for me, each with the characters facing certain directions. I was able to find a position that fit very nicely on the shoe. I also had it help me figure out which color would be best for the background. It was incredibly helpful to have the support - it made the project run so much smoother, which was really needed at the time. I was lined up with 11 different commissions, so it made all the difference. I'll attach a picture of how the shoes turned out! The picture honestly makes them look a little weird, but I promise they look pretty perfect in person, haha.
"
30	creativity_0030	Fiction writing	0	I'm a writer, primarily of science ficti	"Sounds good.  No questions, I'm just ready to get started!
"	"I'm a writer! I'm in the process of working on my debut novel right now, so I'm deep in the trenches of writing and editing my manuscript. Therefore, I have to come up with things like a title, characters, plot, etc.
"	"I don't allow myself to use AI for the creative meat and potatoes of my story, because I want it to be authentic to me. However, I do find myself looking for help for titles in my work by giving AI a synopsis of my story. I also tend to go to it to come up with names that sound good for siblings, last name ideas, things like that which aren't as crucial to the creative part of my work.
"	"I was really struggling with a title for my book. I had everything else, my story was well rounded, but nothing was sticking out within my work that would make the perfect, catchy title. I used AI to brainstorm, which then got my creative juices flowing, and I bounced back and forth with it until we found a perfect title.
So, I started by basically saying, ""here's the plot of my story, here's something significant that happens in it, here are the main characters' namds
Sorry, hit send on accident! Let me start over. So, I started by basically saying, ""here's the plot of my story, here's something significant that happens in it, here are the main characters' names, can you help?"" AI then gave me some ideas, none of which sounded right. However, they did point out something minor from my story I mentioned, which gave me an idea. It was a play on a classic phrase that most people would probably know, but not all. I asked for advice on if it was clear what I was playing off of, and if AI thought people would get it. AI said they likely would, and gave me some similar ideas. One of the ideas it gave was almost perfect, so I changed one word and got a title I love.
"
31	creativity_0031	Audiovisual	4	I'm a musician, so my projects range fro	"No, I am ready to begin.
"	"I am a video producer. I don't have very ""typical"" projects. Right now I am working on a video for a hypnotist and a short animated film about God and His many forms. Earlier this year, I shot an  independent feature film about 4 Generations of black women with sleep disorders and psychic powers. In the past, I was mostly focused on making television and podcasts about technology.
"	"It completely depends on the project - the videos for the hypnotist mix short shots of AI-generated images and video in with traditional graphics and editing. The short about God is all AI-generated video edited together with traditional non-linear editing. The feature film did not use AI, but I am going back now to see it I can stitch together some stills we shot with footage we took by using AI, without it looking like I'm using AI.
The first two projects I mentioned are animated, so it is either easy to blend the AI-generated animation in with the rest of the video, or, in the case if the religious piece, it all looks AI generated, which is fine. But the feature film is all real people, in real environments, so  anything AI-generated has to look real - characters have to be consistent, people can't have 6 fingers, etc.
"	"Right now, I  am trying to make transitions from some photos we took that I photoshopped to look like they are old black and white pictures to color footage of the same moment. Unfortunately, the photos and footage don't line up perfectly, and one is a different shot entirely, so trying to get a smooth transition has been very interesting, but also frustrating. I haven't gotten a result I like yet.
"
32	creativity_0032	Fiction writing	0	I'm a writer, primarily of science ficti	"Sounds good. Let's start with your first question.
"	"I write short fiction stories. The genre varies; Sci-Fi and Fantasy are favorites of mine, but I write in other genres too. It starts with brainstorming, and when I find an interesting idea or concept to try I start researching the topics that might be relevant. I plan an overall arc for the story to follow with some specific events or scenes to keep my later drafts organized. I typically make edits on the fly, but usually make several edits/refinements throughout the process. Once I think I'm happy with how the project is turning out I'll usually take some time away from it before returning to see if I'm still happy with it. Afterwards I upload the story to an appropriate public site if I'm just writing it for fun, or send it to the person who commissioned it in that case.
"	"I do try to limit my use of AI, so it's my voice and writing style and not someone else's. Sometimes I use AI while editing, to make sure what I've written makes sense and flows in a coherent manner, as well as double-check my grammar and spelling. I also sometimes use it for brainstorming, a change in perspective can really help to come up with interesting ideas. I prefer to do my own research for now, however, sometimes Google's AI Overview has links to pages that are useful, but I usually disregard the actual content of that overview and just check the cited webpages instead.
"	"I recently was writing in Microsoft Word, which has integrated AI. It automatically highlights what has been written and prepares suggestions. In the case of grammar or spelling mistakes it is very useful, but sometimes it prepares suggestions that go beyond that. In this particular case it suggested I change some words to make the sentence easier to read when I had written it to emphasize a specific word in that sentence. The suggestion was technically right, it would be easier to read if I followed its advice, but it would have also defeated the whole point of writing the sentence to begin with. I didn't want to see anymore AI suggestions for the rest of the day because I kept thinking that if everyone used these kinds of suggestions to ""improve"" their writing, everyone's style would be the same. No one would have a unique writing style anymore. I suppose the experience made me feel conflicted. AI can be very useful for small corrections, but when it is forced into software it's invasive, encouraging over-reliance on the model's functions.
"
33	creativity_0033	Mix	3	I'm an artist and a writer with a PhD in	"I'm ready!
"	"I do quite a lot of creative work with AI. I do many crafting projects, design social media posts, peruse AI for inspiration for crochet projects and patterns, come up with fun ideas to boost morale at my place of work, etc. Recently, I used AI to design a bubble gum machine logo for my office. It gives out adult prizes. AI helped me come up with a vinyl design that reads: [REDACTED]'s Subpar Prize Machine: Lower your expectations and turn the knob. It has a melty smiley face on it. The staff members love it! I also have used AI recently to come up with many social media posts and inspiration for the dental office I work at.
"	"I ultimately begin with AI to expand on an idea that I have. Let's talk about the bubble gum machine to start. I first saw an old bubble gum machine for sale and thought it would be awesome for staff members to be able to earn tokens to get a spin. When I got my initial idea, I then turned to AI to first get recommendations on fun trinkets to put in that were fun and adult humor. Then I asked it to generate some fun names to call it based on some factors: my office is in the basement, it hands out subpar gifts, it is my own personal machine and not sanctioned by the doctors, etc. After inputting my initial ideas, I was able to conversate back and forth until I settled on the perfect name. After settling on a name, I continued to consult it to come up with a fun slogan so staff members would know not to expect anything super great from the machine, as it is truly just a fun little game to boost morale. After I decided on a fun slogan, I was able to consult it to come up with a design for a vinyl cut out to put on the front of the machine.
"	"I initially stated what I was doing with the project and gave the details I mentioned to you earlier. AI then gave some suggestions and I went back and forth multiple times, over multiple days even, to finally come up with a name I thought was perfect. AI suggested many names to begin with and I would prompt back stating to focus more on one thought process (ex: add more suggestions that have to do with my office being in the basement, give me more suggestions that get the point across that these prizes are basically worthless, give me a suggestion that uses my name, make it shorter because it needs to fit on a 5"" x 17"" glass front and I want the words readable, etc.). After spending quite a few turns (probably 10 over a few days), the model suggested a name I thought embodied the project very well--[REDACTED]'s Subpar Prize Machine. I then wanted to add a little subtext so went back to the model to gain ideas for wording. Again, I needed it to be a short length so it would fit well on the space I needed. After the same back and forth process I mentioned above, I settled on Lower your expectations and turn the knob. I run the ideas by a few friends and they all agreed it was a great name.
"
34	creativity_0034	Fiction writing	0	I'm a writer, primarily of science ficti	"Sounds good. Let's go.
"	"I'm a science fiction novelist. Most of my series have involved time travel, but the current one is a bit of a departure. It's a four-book series set in the late 21st century, and partially takes place on a Mars that is in the final stages of terraforming. My academic background is more historical and political than scientific, so I frequently have biology questions, and sometimes need to know things like how far it is from one geographic point on Mars to another.
"	"Any time I have a question that requires me to use advanced math. :)  I've also used AI to help come up with some basic rules for a language. Occasionally, I use AI as an advanced thesaurus when I can't come up with the right word.  Or when I need to figure out how much a knish might cost at a food truck in 2090 given typical rates of inflation. Stuff like that.
"	"I needed to figure out whether the process of growing lab meat and the quality of the final product would be affected by the lower gravity on Mars.
I simply asked what the differences might be and was then given a list of changes. One of my beta readers is a biologist, and I usually run these things past her, but she was away from the computer. When I spoke with her later, she said that the response was well-reasoned and lower gravity would probably have many of those effects. I like being able to get a general idea on topics like this before I run them past beta readers and other specialists I know, because it saves them time I have my ducks in a row before I contact them. I was less happy with some of the creative suggests for a generic name for lab meat, but I can usually come up with those on my own.
"
35	creativity_0035	Art, design, crafts	1	I do a variety of creative work. I am se	"Sounds great!
"	"I do visual arts in a variety of mediums. An example project may be an acrylic painting, that I may than scan to make prints out of.
"	"I like using AI to brainstorm and when I am stuck. I might use it to help generate a list of ideas when I have a creative block, or to help expand an idea. For instance, if I know I want to paint something using paynes grey with a red accent that has an autumn theme, I might ask AI for a list of possible subject matter or ideas for paintings.
"	"An example of when I used AI was when I wanted to paint a series of woodland themed small paintings. I planned to paint a mushroom in one, a fern in another, and then I asked AI for a list of other ideas to help me come up with other subjects to expand the series on theme. It helped me decide to also paint a fallen tree and wild berries.
"
