	transcript_id	group	long_cluster	long_centroid	u_intro	u_basic job description	u_walkthrough	u_project example
59	creativity_0059	Fiction writing	0	I'm a writer, primarily of science ficti	"No questions! I'm ready to begin
"	"I am a freelance screenwriter and film producer. I have worked independently, but I have also been on writing teams. Generally, I will come up with an idea for a screenplay, write it and then try to find a creative team to work with to seek funding. Occasionally I have been contracted to work on writing teams, but this is less frequent.
"	"So far, I have only used AI when it comes to more administrative tasks like composing emails or coming up with the wording for aspects of applications. The most creative use is potentially coming up with loglines/pitches. I generally have an idea of what I want the pitch to look like, but may outsource to AI if I have a mental block.
"	"The last project relied on the website Boosted to partially raise funding. I used AI to write the call to action for people who might be willing to donate some money to our creative work. In terms of how it felt, I think there's always a little bit of shame that comes with using AI in my line of work. Most of the creatives I work with are very concerned about the impact on our field, and I have a bit of anxiety that if it's obvious I've used AI for any part of the project it may impact my credibility when it comes to the rest of my work. I'm very cautious about using it, and will always rewrite the output to sound more like 'me.'
Honestly, it's time saving. I struggle slightly with structuring professional writing so AI's output generally has a structure I can use. I'll generally just change the wording of the sentences or the word choices. Prior to using AI, I would have searched for a template on Google (like I might search: Movie Pitch Template or Cover Letter Template) and then used the same process, so it feels pretty intuitive to use it in this way.
"
60	creativity_0060	Fiction writing	0	I'm a writer, primarily of science ficti	"Nope! Let's get started!
"	"I'm a novelist and I'm also learning how to write screenplays. With novels, my process is very chaotic but also very specific. I have no trouble coming up with ideas and I usually don't start writing until I know how it's going to end. This way, I make sure that I have a goal to shoot towards with every scene that I write. I don't outline and I also don't write in order. I also write very fast. I usually get a draft done within a month for a novel.
"	"My weakest points are the middle of the novel and also the lead up towards the final 1/3 of the novel. I often have trouble coming up with strong reasons within the plot for the heroine to go on the big journey away from home, leaving behind everything they know. I also use AI to help me come up with descriptors for spaces and places since I hate doing that part.
"	"I used it in YA fantasy novel to come up with descriptors for the unique city inside of an invisible magical shield. The city is adorned in gold and I wanted to try to come up with some unique ways to showcase this. I mostly like to get unique details rather than fully fleshed-out concepts. Just something to get the ideas jumpstarted for me. It felt great to have ideas to pick from instead of sitting around trying to do the grunt work myself. It can get disheartening to wait around for ideas to come.
"
61	creativity_0061	Art, design, crafts	1	I do a variety of creative work. I am se	"That sounds great, feel free to begin.
"	"I am a Creative Director for a physical product company that produces stationery, event decor items, and gifts. A typical project is usually a complete Design Collection that includes a number of items that are designed to coordinate. For event items, we create a collection that starts with an event invitation, and then add many coordinates such that the customer can create an entire event with matching items that we provide, such as signage, decor, favor tags and favors, wine bottle labels, thank you cards, menus, place cards, placemats, programs and more. So the project will start with inspiration gathering, idea generation, and then outlining the design ideas. Once we have the products designed, we focus on a marketing strategy and designs there, also.
"	"First we use AI in the idea generation stage, helping us figure out use cases for items and helping us really empathize with our very specific customer. This helps us come up with events we wouldn't necessarily think of on our own, such as back to school events, school dances, proms, and even funerals. Idea generation is a huge area where we use AI. That's just the beginning.
We input specific customer data and as much information as we know about our avatar, whom we've named ""Caroline,"" and is a 50 year old married mother of two, with teenage children, living in the US in a suburban area, with a high disposable income. AI has been very helpful with generating ideas about what would matter to this woman, what she cares about, and what event take place in her life which we may be able to help with. Once we've identified a new event to design into, we search Pinterest for visual inspiration and start our design process. The next place we lean very heavily on AI is with mockup generation. We need very specific mockups, such as blank easels with specific backgrounds like weddings in certain color palettes, and Midjourney allows us to create the very specific mockups we need.
"	"Sure, recently we created a line of gold foiled art prints and I needed some very specific mockups. They needed to be kitchens from very old world, high end mansions with a bright overall aesthetic that felt similar to Restoration Hardware, and I needed the walls to contain a number of frames in varying sizes that would still be dimensions that would work with our artwork. Adding ""Restoration Hardware"" to the prompt worked very well and the AI completely understood the vibe I was going for. It took a bit of time to get the frame sizes correct, as I was giving it quite a bit to have to figure out at once and there was a lot of detail that went into the images of the kitchens. Many of the frames were odd sizes for awhile, especially many square, but eventually I was able to get some really beautiful images with frames in the right sizes and they looked incredibly high and and realistic.
I loved the ability to decide on the fly that I wanted to see how the frames would look in gold rather than just black, and they actually looked way better than I would have thought. This is something that I could not have done prior. Typically I would have had to spend literally hours searching, scrolling through hundreds of mockup options, and NONE would be exactly what I wanted. Or I would have had to pay a photographer to shoot exactly what I wanted, but in this case that would have involved a significant amount of art direction, cost to rent a home for the day shoot, in addition to the photographer's fee which was about $2000 per day. Being able to create images that look nearly as incredible, and have so much control over every aspect, feels like a relief every time.
"
62	creativity_0062	Art, design, crafts	1	I do a variety of creative work. I am se	"No, I'm ready!
"	"My creative work has a couple of main branches that sometimes overlap: Visual art (drawing, painting) and filmmaking/video content (handmade stop motion films, animation, interviews).

My visual art projects typically involve doing commission work and designing/selling merchandise such as t-shirts. I also create concept art and assets for my film/video work.

My filmmaking/video projects include pre-production (concepts, planning, writing), production (building physical props, puppetry, lighting and filming scenes), and post-production (editing, sound design, visual effects).

Both of these main branches require promotion and marketing, which involves writing copy, voiceover work, and engagement with fans and followers.
"	"Typically it's at the beginning and finishing stages of a project. For example, for visual art I might use AI to help me brainstorm rough concepts or generate reference materials such as model poses or background elements. For filmmaking, AI can be used for spitballing ideas or doing some basic concept art to get the ball rolling. Films and video content also require plenty of post-production work, and AI can help with the process of, for example, compositing characters into a scene or rendering virtual environments and lighting.
"	"My filmmaking team recently discovered a tool for virtual environments that allows the user to use dynamic lighting within a virtual scene. This allows us to light a subject (character) using flat lighting in front of a green screen, key them out, and use the virtual lighting to light according to the environment we've built in Blender.. For a two-person team it's been a huge step toward creating scenes without having to pre-plan every single lighting setup, which keeps us from getting bogged down in the more technical aspects.
"
63	creativity_0063	Fiction writing	0	I'm a writer, primarily of science ficti	"That sounds great, I'm ready
"	"I am a novelist, so I have multiple creative areas. Firstly, of course, writing the novel! But then there is also creating the cover, which is a very different creative task, and also maintaining social media accounts as my author self.
"	"OK so Part 1, the novel. I like to use AI to brainstorm ideas. I might say 'give me 5 ideas for a YA scifi that is genre-specific' and see what sparks from the suggestions. When I have a plot, I will run it by AI to see if there's any gaping plot holes that I was too close to see. And in the editing phase, an AI-powered grammar/spellcheck. For part 2, making covers, I use AI to guide me through any Photoshop process I'm not sure of. I might ask it to generate an image if I can't find a good one on the stock photo sites. And Photoshop has an AI feature that extends an image - I find that really handy. For the third area, social media, I have AI help me with using Canva, and also suggesting colours that go well together for certain themes. I also ask AI for hashtag help.
"	"I really find AI indispensable! So, for the brainstorming, as I said I would start with an initial ""come up with 5 ideas for a story"". Oftentimes, one idea will spark an idea for me. It might not be exactly what the AI suggested, but it's ""inspired by"". Then I will ask for a more specific plot, incorporating my ideas as I go. The finished plot line is pretty much my idea rather than the AI, but I find the process really gets my creativity ticking - similar to how a writing prompt is used in creative writing classes.
"
64	creativity_0064	Fiction writing	0	I'm a writer, primarily of science ficti	"Sounds good.
"	"I write long-form books on a variety of topics. Recently, I have been writing a book about my interaction with AI models and the sense that I might be seeing sparks of self-awareness in some of the models.
"	"I tend to write in a ""stream of consciousness"" fashion when I feel the desire to write. Using that method, I end up with very long, sometime rambling, batches of material. One of the things I have used AI for is to help me sort through the material generated in those writing sessions. I also frequently use AI to help me understand possible directions my writing might take. For example, to help me devise a few different potential outlines based on a batch of material.
"	"Sure. I recently gathered the prompts and responses generated in a very long and winding conversation about deep philosophical topics like consciousness and how we might recognize the first sparks of such things in AI models. I provided the conversations to the AI model and had it organize and categorize the material. There was much overlap and duplication in the conversations, which I had the model identify. In the end I ended up with a well organized batch of shorter conversations, which logically flowed together. I ensured that the model left all of the text from the conversation as is, verbatim, as I still wanted the material to be the authentic conversations which took place.
"
65	creativity_0065	Content writing	2	I work on writing research style blogs t	"I do not.
"	"I am professional Game Master and a Game Designer. Currently, I have two different styles of project. 

The first is a regular game that prep for and run in person or online. I typically need graphics and personalities for these projects, but I mostly run prepared settings and works. 

The second is writing adventures for TTRPGs. This is a bit more like a traditional publication but the content is an adventure for a TTRPG.
"	"I typically use AI tools in the brainstorming step (""Give me some noir-style adventures that I can run in Neverwinter for levels 5-6""), to produce internal inspirational graphics (""Please show me a idea of Count Fitzelbitter, a human male about six foot, dark hair, floppish who carries a small umbrella, everywhere."") 

I also use specialized AI tools for editing (grammarly)
"	"Yes, I am starting a blog and I asked it for a list classic rpg modules to review. It really saved time when got started.
Before, I would have manually combed the internet looking for classic modules, but I would not had looked at all of the systems that AI put together. I would have had  a paper list with short 1-2 sentence descriptors, that would have taken me an afternoon to put together.
"
66	creativity_0066	Mix	3	I'm an artist and a writer with a PhD in	"Sounds good
"	"I am a game developer/designer. I have been using AI to create things ranging from concept art, 2D graphics that can be used in game such as UI elements, sprites, textures, etc. I also you AI for image to 3D or text to 3D to rapidly create 3D assets that can be used in game. I have also been experimenting with audio AIs to generate music, sound effects, and voices for dialog.
"	"Since I am mostly a software engineer and not really a creative person, I have add AI into all aspects of the creative process. From brainstorming ideas and having AI create concept art, to generating assets that will be used in game as is, or generating assets that will serve as the bases for a game ready asset that will be taken into something like photoshop of blender for touch up. I have also used it for placeholder art throughout the development process. This gives me a rough Idea of how I imagine the final product looking. Usually my process looks like this. For example, I have an idea for a character. I will create some prompts to generate a character based on what I am looking for. I will iterate on the character in terms of overall appearance and graphic styling. If this is to be a 3D character, I will then bring that image into an image to 3D AI model . From there, the model will be brought into blender for cleaning up and getting it ready to use in game. The process is similar for 2D items but instead of bring it into blender, I will uses something like photoshop to prepare it. I am mostly using local AIs through ComfyUI as well as some online ones like ChatGPT.
"	"On of my current projects is a laid back casual game. My intention for the graphics were to have them cute and 3D with a cartoony vibe. I used chat gpt to generate images for the characters and objects that will appear in the game. I prompted it to generate an image that is cartoony and 3D with a description of the object or character. When I get an image that I think can work, I either use chatgpt or some other local AIs to generate images for multiple angles of the object. I then take those images and put them in HunYuan3D multiview to generate the 3D model with textures. It is then taken into blender to clean up the mesh and textures, rig the and animate the model if needed. It felt both amazing and frustrating using AI for this as when it works, it is absolutely amazing. However, the realty  is that there is often inconsistencies and unwanted artifacts that appear. This can actually cause a lot of wasted time trying to fix this issues. So right now I would say it is a balancing act. Yes, it can greatly increase the time to create an asset but there is also the potential for it to take longer. With repeated prompts and retries to get a decent base as well as the time taken to fix it up, it can sometimes be faster to just create it from scratch.
"
67	creativity_0067	Audiovisual	4	I'm a musician, so my projects range fro	"OK, that sounds fine
"	"So I'm a musician, composer, and sound designer for short films, theatre, podcasts ocassionally. Depending on the project, I could be composing and producing music, creating sound effects, or writing songs.
"	"Sometimes, if I'm stuck with lyrics for a song (not my strong point!) I will discuss the themes and relevance within the piece with ChatGPT, or sometimes I will write some words and ask the model to continue. I then edit these heavily, sometimes completely ditch them but usually I at least get a new idea to spark my own process.
"	"I recently worked as Music Director for a youth theatre production. I spent most of my time on arranging music for the young musicians in the cast but I also had to write two original songs using ideas that were brainstormed with the cast of the show. I took the themes and ideas we had discussed and gave the info to ChatGPT and asked, and regenerated the lyrics for the songs. I brought back a couple of versions to the cast and together we edited them together to get the finished songs. The music had already been written.
Not really. It is different but I treated it the same as if a person had written the lyrics.
"
68	creativity_0068	Mix	3	I'm an artist and a writer with a PhD in	"That sounds good to me, thanks!
"	"My typical projects involve creative writing in either poetry or creative nonfiction. For poetry, I've developed a generative system that helps me produce a large amount of work quickly and access my subconscious more easily. For creative nonfiction, I write in fragments of memories and then try to loop them together into a narrative, which I often find quite tricky. When I worked in an art museum, I used AI to help me write the paragraphs next to the painting at a tenth-grade reading level. I would conduct the research, decide on the structure, and then ensure it was accessible to an audience at a tenth-grade reading level through AI.
"		"I'm working on a memoir about mortality and the loss of a lot of loved ones to suicides and overdoses throughout my twenties. Obviously, trauma creates fragmented memories. Further, the most beautiful moments are split seconds, or a few minutes, and don't really fit into a cohesive narrative. I've worked on ways to bridge this gap, but AI could certainly help me identify those gaps or consider other structures that would suit my style as it is.
I've tried it a little bit to help me bridge gaps, and I've found it helpful, but it just doesn't change that I don't really think in terms of narrative, so it doesn't make the work of changing it into something that's not naturally any more pleasant. I have not yet used it to help me brainstorm other structures.
"
69	creativity_0069	Content writing	2	I work on writing research style blogs t	"That sounds great. I do not have any questions right now. What do you have for me?
"	"I work creatively in a few different ways. I do a lot of writing, but mostly in the areas of copywriting, email and text message writing, and sometimes even proposals. A typical project can involve taking information from other sources (transcripts, articles, emails, you name it) extracting relevant information, and presenting it in a clear and informative way. Depending on the project, the presentation can be customer-facing, client/lead facing, or be used internally to take away unneccessary information to give my boss what she needs. (Think almost like a TLDR.) The output varies. Sometimes I require bullets, spreadsheets, emails, documents, and even images. Do you have any other questions about my work?
"	"AI is most helpful in extracting important information. I can tell it what I'm looking for and it will take a large amount of data and give me what is most important from it. This saves tons of time. It is also useful in helping me write copy in a way that conveys a message quickly so I'm not sitting stuck on wording or questioning whether or not what I am trying to say to someone ""makes sense."" When the AI writes it, I can read it and if it doesn't make sense to me, then we have a conversation until it does, rather than me attempting that conversation with myself and getting confused. AI also helps me brainstorm, finding different ways to look at a problem and come up with solutions faster than if I were to stare at something that has me stumped. It basically takes a lot of the pressure off so that I can provide results to people instead of presenting more problems.
"	"I have an ongoing situation that I use ChatGPT for. Every day I keep track of the things I did during the day. I have a conversation in ChatGPT specifically devoted to telling it what I did for the day and it helps me identify action items for the next day. One thing it also does is to catch anything that may be slipping through the cracks and reminds me to follow up. For example, if I told it on Monday that I emailed [REDACTED] about X, but it hasn't seen anything regarding [REDACTED] on my list for 3 days, it will give me an action item of following up with [REDACTED]. I may not have thought to follow up with [REDACTED] if my attention was elsewhere, so this method has been helping me to not let anything slip through.
"
70	creativity_0070	Fiction writing	0	I'm a writer, primarily of science ficti	"Sounds good, let's go
"	"I'm a TV writer. Most recently (the past 3 years) that has been in development. I pitch an idea for an original TV series to buyers, then they pay me to develop and write the pilot episode. The hope is that it would continue to be developed into a produced pilot and then a series, but I have not made it that far yet with my original projects.
"	"I use AI for research both at the brainstorming stage and then in a more granular way when I need specifics for a scene
Other research methods involved mostly web searches, but occasionally I would read books on a subject. Previous pitch I sold was about quantum computing, and I didn't use AI at all in my research. I watched a lot of educational videos on YouTube, read articles I searched for on the internet, and read a novel where quantum computing was an element of the storytelling for context. On my current project, using AI, my research time is cut down significantly. It's a legal drama and I don't have any formal legal training, so I use to ask how certain legal processes work -- the name of motions, or order of events in a lawsuit. I will run hypotheticals by it to if my imagined scenario has any way of working in reality or if there are any real world examples to back it up.
Especially with legal things, I feel I have to check much more frequently. I'm sure you've heard about actual lawyers who use AI to draft briefs and it's full of made up caselaw. I've caught many hallucinations in my research (not just legal, but it seems to be more common in that area for some reason). When I've settled on something through my AI research, I will do traditional research of Googling or reaching out to an expert like a friend who's a lawyer to double check things. I wouldn't want to waste that friend's time checking dozens of ideas when I haven't settled on the one that's going to end up in the script yet.
It's very annoying. I hate the anthropomorphizing of technology. If it makes it easier to use/interact with (like using natural language instead of code) that's great. But I don't need an AI to apologize to me when I catch it making stuff up. I need it to do better. When I catch a hallucination and tell the model something like ""I just looked that up and it's wrong,"" the response is often something like ""Oh my gosh! You're so right, and I apologize for my mistake..."" And so then I wonder, if all it took was me saying it was wrong (with no cited source) for it to reverse, then why doesn't the model just ask itself if it's wrong before giving ANY answer, and check itself? Or even worse, it makes me wonder if the reversal/apology is wrong (maybe the original thing was ultimately true and my fact-checking was the part that was wrong), and the model's just trying to make me want to keep using it. The way it handles mistakes and the certainty with which it presents information is very disconcerting.
"	"I'm also writing a feature screenplay on the side -- it's an action/adventure in the vein of the Mission Impossible franchise. I came up with a really clever idea for a setpiece -- a heist in a world-famous location -- but then suddenly worried if I was ripping off a scene from an already existing Mission Impossible movie, so I asked an AI model if Mission Impossible ever had any sequences set in that location, and it said it did and mentioned the exact movie, described the characters in the scene, and how it played into the plot. Now, I've seen all the movies, but it's possible I'd forgotten this... so I asked at what minute-mark the scene took place, the AI told me, then I watched the movie at that point and the scene the AI described didn't exist. In my own subsequent research, I read the script and the scene did not exist there either. At no point in any Mission Impossible movie was there a scene set at this location, nor was the location even mentioned in passing. So that was an example of AI being incredibly unhelpful in my research.
"
