lemma,noun_roles_top,head_verbs_top,amod_top,compound_top,examples
description,obj:14 | obl:7 | conj:3 | nsubj:2 | compound:1,write:4 | create:2 | provide:2 | come:2 | generate:2 | refine:1 | get:1 | capture:1 | use:1 | base:1 | build:1 | creat:1,sonic:1 | related:1 | good:1 | perfect:1 | short:1 | brief:1 | old:1,listing:3 | video:1 | conception:1 | performance:1 | product:1 | eBay:1,"So I told ChatGPT about the themes of the tracks , and a sonic description of each song . || For the YouTube , a typical project is storyboarding the video , shooting the footage , editing , then prepping thumbnails , writing descriptions and titles , etc . || I also use VidIQ and YouTube 's AI tools to assist me with refining my video descriptions and titles . || I wrote up the description , but I was struggling with a catchy title ( as I often do ) ."
output,obj:10 | nmod:7 | nsubj:5 | obl:3 | conj:1 | nsubj:pass:1,improve:3 | alter:2 | use:2 | mean:2 | inspect:1 | download:1 | rewrite:1 | have:1 | vary:1 | produce:1 | expect:1 | look:1,creative:4 | good:3 | own:2 | generate:1 | complete:1 | final:1 | increase:1,AI:1 | audio:1 | image:1,"The biggest change is the time I now save and therefore a better output . || There is one creator who only puts out AI - generated assets , and does n't alter them much from the generated output , so he can put out a new asset pack once or twice a week and charge $ 6 for each pack because of how good they look and how many assets are included . || I have used AI for complete creative output for things like , say , when a relative wants a logo for their business that looks very "" painterly "" — not my forte , but they are also less aware of what is AI - generated , so a good AI output plus some touchups in Photoshop means that I do n't have to expend as much effort for projects that are either unpaid or involve multiple changes if the "" client "" does n't know what they want . || That , and as I wrote previously , there are some who do take what AI says as gospel and they fail to fact - check or inspect the output for mistakes ."
market,obj:8 | nsubj:5 | obl:4 | nmod:3 | compound:3 | nsubj:pass:2 | conj:1 | root:1,flood:3 | oversaturate:2 | upload:1 | use:1 | look:1 | add:1 | crowd:1 | be:1 | become:1 | make:1 | hit:1 | clutter:1,appropriate:1 | tough:1 | certain:1 | local:1,flood:1 | job:1 | end:1 | art:1,"I 'll then draw the assets on Procreate , export them to my PC , organize and name the files , create product listing images and promos for them , then upload them to the appropriate markets . || I 'm worried that the AI - generated assets will oversaturate the market and take exposure away from creators who design things by hand . || There 's AI writing stories and "" stealing "" readers , allegedly , but if readers think AI - written stories are "" good , "" then that 's their business , and they 're probably not my market anyhow . || While it can be abused , this will not be at the cost of human creativity , of the market for human creativity ."
cover,obj:10 | compound:8 | obl:5 | nmod:2 | conj:1 | xcomp:1 | root:1,create:3 | make:2 | generate:2 | design:1 | judge:1 | draft:1 | need:1 | work:1 | paint:1 | look:1 | complete:1,heavy:1 | own:1 | complete:1,book:5 | placeholder:1 | artist:1 | album:1,"Another project I used it for was to help design a book cover layout that I was pressed for time to illustrate . || In the field in general , I 'm super concerned about the use of AI to write stories and design book covers . || I used AI to help create a placeholder cover for my game - something eye - catching that helped visually represent what the game was about and attract players to my table . || I am working right now on the content of the first one , and once I have it finished , arranged , edited , etc , I will design the cover and publish it to Amazon and possibly other avenues , in digital and paperback versions ."
thought,obj:9 | obl:5 | nmod:4 | compound:4 | conj:3 | nsubj:2,use:2 | record:1 | translate:1 | ask:1 | come:1 | put:1 | refine:1 | hear:1 | lead:1 | order:1 | iterate:1 | organize:1,own:4 | creative:1 | certain:1,side:1,"I especially like recording my thoughts . || AI is already able to create photorealistic or stylized videos - I think in the future it will just get better at translating the users thoughts and ideas into something tangible - the foundation is there and only getting stronger . || For models that provides follow - ups and their own thoughts or perspectives , I think AI does consider things that I have n't considered before . || And creatively , it 's been a great sounding board for ideas , like with the organization of the book , where I can tell it what I am trying to do from a very high level , and ask for thoughts and ideas on how to accomplish it , and we can go back and forth with iterations of the ideas , and it will make suggestions that I might not go with precisely but will sometimes spark a different way of viewing things that will help me decide on the right approach ."
money,obj:15 | obl:4 | conj:3 | nmod:3 | xcomp:1 | compound:1,make:12 | hit:1 | stiff:1 | earn:1 | donate:1 | mean:1 | have:1 | save:1,less:2 | decent:1 | most:1 | much:1 | more:1,,"I imagine that if a human VFX designer could use AI tools to automate some parts of the process , it could save a lot of time and money in what is currently an expensive and time consuming process , allowing us to create more realistic looking and exciting visual effects quicker and for less money . || I find that when a long caption is needed , say for an Instagram Reel like I needed here , it does excellent and hits it on the money every time ( Granted , I provide a lot of detail . || I run a small business / hobby ( technically a business , since I make money from it and treat it as a business ) doing fantasy map commissions for independent authors and DnD players . || There are people in book publishing making money by having AI write books for them and I think that 's both both morally wrong and leads to an inferior product ."
tone,obj:14 | conj:5 | nmod:4 | obl:4,use:2 | achieve:1 | have:1 | lose:1 | ask:1 | preferese:1 | know:1 | change:1 | meet:1 | set:1 | find:1 | write:1,right:2 | consistent:1 | particular:1 | necessary:1 | specific:1 | whole:1 | overall:1,skin:1,"I felt positive about the experience , as using AI helped me achieve a consistent tone and saved a lot of time from having to research things and write from scratch || I make sure all content undergoes multiple human checks , not only to ensure there are no hallucinations , but also to check for any issues with tone and style . || There is no HR department on film or TV productions usually so those tasks fall to the production management team who are not necessarily HR experts , so it 's helpful to use AI to draft something that has the right tone . || I would AI to evolve to the point that it has a deeper understanding of tone and style in shifting contexts ."
reader,obl:10 | nsubj:7 | nmod:4 | conj:3 | obj:2 | root:1,feel:2 | act:2 | think:1 | run:1 | use:1 | love:1 | want:1 | land:1 | turn:1 | keep:1 | double:1 | capture:1,human:2 | intuitive:1 | casual:1 | many:1 | western:1,beta:4 | steal:1 | time:1 | proof:1 | day:1,"But it wo n't have the deeper nuances that only a human can weave throughout the story - the slow burn emotional response a reader might feel from reading a book by an accomplished author . || There 's AI writing stories and "" stealing "" readers , allegedly , but if readers think AI - written stories are "" good , "" then that 's their business , and they 're probably not my market anyhow . || I had all of these devotionals which I had written individually but did n't want to just put them in a random order , or something kind of arbitrary like alphabetical , and I did n't necessarily want to go in biblical order by the passage I used for each one , but something that would be meaningful for the readers . || One of my beta readers is a biologist , and I usually run these things past her , but she was away from the computer ."
track,obj:17 | obl:5 | nmod:2 | appos:1 | compound:1,keep:11 | lose:4 | make:2 | get:1 | send:1 | split:1 | stay:1 | record:1,several:1 | different:1 | specific:1,,"For example , I have an EP 's worth ( 4 tracks ) of instrumental electronic music . || So I told ChatGPT about the themes of the tracks , and a sonic description of each song . || Then I told it the 4 working track names , what I liked , and what I did n't . || He sometimes makes tracks with Suno AI and writes over them ."
edit,obj:13 | conj:8 | obl:4 | nsubj:1,make:6 | do:2 | see:1 | clean:1 | have:1 | rewrite:1 | generate:1 | finish:1 | use:1 | flow:1 | recommend:1 | change:1,several:1 | minor:1 | second:1 | obvious:1 | basic:1,level:1 | correct:1 | AI:1 | seo:1 | self:1,"Often I 'll get AI to do the heavy lifting of writing the initial content , then I 'll "" tidy up "" , making edits to give a more human feel and remove any typical AI phrases or giveaways . || I pretty much run the show , I come up with content ideas , film , edit , generate captions / hashtags , post and even respond to comments . || I 'd say it primarily has just become a bit faster and easier , like when I used to do all manual proofreading / editing , it took a lot longer because I would read and reread , literally forward and backward , to make sure I caught everything , and then I would do word level , sentence level , and paragraph level edits , with multiple rereads for each . || I typically make edits on the fly , but usually make several edits / refinements throughout the process ."
moment,obl:11 | nmod:5 | obj:3 | root:2 | nsubj:2 | conj:1 | nsubj:pass:1 | obl:unmarked:1,capture:2 | see:1 | have:1 | love:1 | feel:1 | react:1 | become:1 | split:1 | get:1 | begin:1 | think:1,same:1 | final:1 | beautiful:1,,"At the moment , for me personally , I do n't see things changing much . || No , nothing in particular at the moment , thank you ! || The author gave me a story outline for the trailor , 5 - 6 scenes or ' moments ' he wanted short videos or images for - such as a scene walking through a favela , or standing on a hill above the city . || The ability to make truly creative decisions is at this moment , still largely a human ability , and I feel like as the years go bye , and the ability to generate what are at their core standard artistic pieces - following the rules and logic that artistic theory presents - creates a scenario where unique and special talents are not going to enter the field as they see it is saturated or a waste of time ."
feature,compound:10 | obj:6 | nmod:4 | obl:3 | conj:1 | ccomp:1 | nsubj:1,use:2 | have:2 | keep:1 | rely:1 | think:1 | find:1 | become:1 | add:1,new:1 | specific:1 | suggest:1 | graphic:1 | change:1 | great:1 | certain:1,AI:4 | optimize:1 | suggest:1 | version:1 | history:1,"Having an engine to keep up with algorithms , feature changes , and trends to point those details in the right direction is helpful . || I used VidIQ 's Optimize features to get recommendations for titles and test refinements to my description and determine what keywords to focus on . || Before AI , I dedicated more time to researching what was changing with social media , keeping up with new features , etc . || Using the suggest feature in the sketch menu , I did end up finding something I liked after using it for a few minutes ."
perspective,obj:9 | nmod:6 | obl:5 | conj:3 | nsubj:2 | compound:1,refine:1 | capture:1 | look:1 | find:1 | give:1 | help:1 | challenge:1 | explore:1 | agree:1 | write:1 | have:1 | express:1,different:4 | unique:3 | own:2 | same:1 | creative:1 | proper:1 | isometric:1 | good:1 | Marxist:1,person:1,"It was fun but also it helped me refine my own perspective somewhat . || Personally I 'm not sure an AI will ever be able to capture the same unique creative perspective that a human could have because it necessarily has to rely on data that already exists , which makes me think it would struggle to come up with something new . || I already find that AI can write better than the majority of people I know , which is great from the perspective of looking for a collaborative storyteller to simply toss ideas back and forth with , however , I also wonder if that 's feeding into the ongoing existential crisis of loneliness , if humans are becoming less authentic , less emotionally - intelligent because they rely too heavily on these tools . || I am committed to supplying the "" raw data "" - my writing in my style and my images and videos from my perspective ."
past,obl:24 | nmod:2,use:4 | have:3 | do:2 | focus:2 | take:1 | need:1 | shift:1 | edit:1 | talk:1 | find:1 | help:1 | give:1,,person:1,"In the past it would take a while to pull information from scattered sources . || In the past , I 'd do a Google search and check links and read general articles to get an overview point and then start doing the deeper research from there , so AI is essentially doing that initial Google search and general reading and compiling it for me . || In the past , I would need to access many different tools to create the content I was able to create using one AI driven tool . || In the past , I had to "" dumb down "" many of the things I wanted to produce because either the tech was n't readily available or I did n't have the knowledge to use it effectively ."
picture,obj:14 | obl:5 | compound:4 | nsubj:1 | advcl:1 | nmod:1,edit:2 | paint:2 | treat:1 | add:1 | attach:1 | make:1 | look:1 | turn:1 | build:1 | get:1 | put:1 | capture:1,original:2 | old:1 | black:1 | horrible:1 | clear:1 | multiple:1,wip:1,"If there is anything like a game ad / trailer video , then I usually treat that like scoring to picture . || Having to plan the design in Cricut is so time consuming especially when adding pictures so having AI be able to do this , which I think is more than capable , would be a life saver . || I 'll attach a picture of how the shoes turned out ! || The picture honestly makes them look a little weird , but I promise they look pretty perfect in person , haha ."
eye,nmod:9 | obj:8 | obl:5 | compound:2 | nsubj:1 | appos:1,have:2 | look:2 | come:1 | want:1 | happen:1 | close:1 | revisit:1 | roll:1 | put:1 | do:1 | glue:1,human:2 | red:1 | own:1 | googly:1 | polished:1 | intricate:1 | embroider:1,plastic:2 | googly:1,"Brute forcing image generations can help with that , so I can at least begin to think , "" yes perhaps they would style their hair that way "" or the shape and color of their eyes . || For example , if I plug my photo into an image generator / manipulators , I can all but guarantee that my skin will be lightened , my hair texture will be loosened , my eyes might come back lighter , nose slimmer , and my body will probably be smaller . || But the best photos of the grandparents had red eye and they were n't smiling . || I 'm sure some people have made AI make proportions and compositions look pleasing to the human eye , especially for images that are meant to appear candid or not dead center , but it 's not too different to studio photography in that aspect ."
fact,obl:9 | compound:4 | obj:4 | nsubj:2 | advmod:2 | conj:1 | nmod:1 | root:1 | parataxis:1,check:6 | think:2 | matter:1 | struggle:1 | ask:1 | provide:1 | get:1 | take:1 | worry:1 | have:1 | mix:1 | mention:1,interesting:2 | historical:1 | much:1,,"I also occasionally use it for proofreading and fact checking by copying in written content to check it . || That , and as I wrote previously , there are some who do take what AI says as gospel and they fail to fact - check or inspect the output for mistakes . || I do n't think AI will be able to fully replace humans for creative tasks , but this fact really does n't matter either way . || I do struggle with the fact that even if I copyright my work , it is in digital format which means it will be used at some point by AI to complete a project I wo n't be paid for ."
fiction,conj:5 | compound:5 | obl:5 | nmod:4 | obj:3 | appos:2 | root:1,write:1 | work:1 | flood:1 | churn:1 | shuffle:1 | read:1 | provide:1,literary:3 | creative:2 | short:2 | formulaic:1 | create:1 | original:1 | make:1 | much:1 | feel:1,flash:2 | science:2,"I write creative fiction . || Up to now it 's been flash fiction and short stories , and I 've won awards for some of them . || I am also a creative writer , focusing on poetry , short fiction , and personal narrative essays . || I 'm a writer , primarily of science fiction and fantasy , so a project for me would be a book or a series of books , which can take months or years from start to finish ."
side,obl:12 | compound:4 | obj:3 | nmod:2 | nsubj:2 | obl:agent:1 | conj:1,come:2 | work:1 | get:1 | reach:1 | write:1 | require:1 | send:1 | go:1 | drive:1 | focus:1 | keep:1 | have:1,creative:6 | social:1 | other:1 | technical:1 | artistic:1,media:1 | video:1 | business:1 | writing:1 | research:1 | admin:1 | audition:1 | programming:1,"Over the past 6 months , I began to work closely with the social media side of things at my Martial Arts locations ( they 're sister schools ) . || If not explicitly told , I do n't think AI can distinguish between main characters or side characters very well , which does break up the flow . || For a recent YouTube video , I did a side - by - side comparison between two different hair gels . || I would hope that it would evolve to become more sophisticated over the years , involving less back and forth ( as the wedding photos ) and being able to give me "" parts "" that I can use to assemble a whole — isolate these people and make the shadows come from the other side , extract this text , generate a sunset with clouds shaped like hearts , but not too "" clean , "" then I could just focus on making it look natural ."
form,compound:8 | obl:7 | obj:4 | conj:2 | nmod:2 | root:1 | advcl:1,take:2 | tell:2 | shift:1 | feel:1 | involve:1 | consider:1 | use:1 | change:1 | fill:1 | create:1,short:4 | long:2 | many:2 | various:2 | different:1 | usable:1,art:2,"Dance is an art form that has been practiced since the dawn of time . || By being able to just spit out what is racing through my head and have a LLM generate the perfect captions , even adhering to shifting things slightly for different forms on content is incredible . || Some of it is simple as editing , however , my main writing projects typically take the form of a choose - your - own - adventure gamebook . || So , essentially it has aspects of a long - form novel while also incorporating simple coding for the sake of branches and managing stats ."
note,obj:10 | obl:4 | nmod:4 | nsubj:3 | conj:2 | compound:1 | nmod:poss:1 | parataxis:1,make:4 | take:2 | write:1 | generate:1 | gather:1 | fill:1 | clean:1 | go:1 | read:1 | have:1,brief:1 | random:1 | messy:1 | more:1,Google:1 | character:1,"It feels much more inorganic when I need to constantly write down notes for an evolving situation . || I asked the AI to generate a diary entry based on some brief notes that I had scribbled down while I was thinking about a whole lot of random things . || The model had to make sense of these notes and try to put them together in a coherent narrative . || In much the same way that pre-computer , I had to go to the library and drag physical books to a table and page through them and make notes with pen and paper but then having the same ( and more ) information available at my fingertips on a computer made research more efficient and convenient , now using AI makes the process a little more efficient and convenient ."
software,obl:7 | nmod:6 | compound:4 | obj:4 | conj:3 | nsubj:1,use:2 | have:2 | force:1 | rely:1 | purchase:1 | worry:1 | deal:1 | work:1 | do:1,denoise:1 | complex:1 | creative:1,AI:5 | editing:2 | oil:1 | company:1 | production:1 | Blender:1 | would:1 | modeling:1 | graphic:1,"Well the music production space ( even pre -AI ) has become flooded with a lot of snake oil software products . || Each veterinary location was owner managed but made use of company software , followed common procedural steps with business operations ( including training ) and worked to meet the business objectives of headquarters . || To do this I used AI software through a company called Thinglink . || Using this AI software allowed me to take static images and information and make them interactive , including opportunities to use augmented reality ."
system,obl:7 | obj:6 | nmod:4 | compound:3 | conj:2 | nsubj:2 | acl:relcl:1,use:3 | prompt:1 | orbit:1 | game:1 | develop:1 | integrate:1 | see:1 | paste:1 | jump:1 | struggle:1 | throw:1,valuable:1 | package:1 | generative:1 | run:1 | custom:1 | know:1 | more:1 | true:1,support:3 | AI:2 | storm:1 | star:1 | D&D:1 | 5e:1 | talkback:1 | communication:1 | branding:1 | markdown:1 | game:1 | niche:1,"Personally , I feel like it has the potential to be exactly the way you described it , a valuable support system for when I 'm mentally fatigued or facing difficult challenges with technical aspects of the work I do . || I will typically create a "" line "" , like a series , of tokens that follow the same aesthetical style and I have created in Gemini a variety of system prompts , like one for generating prompts of aesthetical styles , and one for generating images from those prompts that meets the typical standards and aesthetics of a token that I need . || Rarely have I found the AI particularly to be "" creative "" if you will , specifically as I am not sure I could say that the system prompt 's I have written allow it to exist outside of typical artistic norms . || I 'm not sure if LLMs are the future - smaller scale , individually packaged systems for specific fields and uses may be more appropriate and effective ."
service,compound:8 | obj:6 | nmod:4 | conj:3 | obl:2 | nsubj:2,grab:1 | employ:1 | do:1 | describe:1 | provide:1 | supplant:1 | report:1 | use:1 | avoid:1,generative:1 | cheap:1 | straight:1 | actual:1 | specific:1 | certain:1 | fast:1,AI:2 | hour:1 | church:1 | imaging:1 | be:1 | ai:1 | music:1 | customer:1 | performance:1 | stream:1,"I 'm exploring time - saving functions , such as using Opus Clip to grab shorts from a two - hour church service . || For the art that I sell , I often employ generative AI imaging services ( such as Midjourney ) and combine it with details I craft . || Companies wo n't hire people for things like game audio or scoring a tv ad if a cheap ai service can do it at a good enough level . || Ai music services like udio are fun to mess around with , but are n't really useable for professional use in their current stage ."
ChatGPT,obj:7 | nsubj:4 | nmod:4 | iobj:2 | conj:2 | obl:2 | nmod:poss:1 | appos:1 | ccomp:1,use:7 | give:3 | ask:2 | tell:1 | know:1 | think:1,,,"Sometimes , when it comes time to add lyrics , I 'll ask ChatGPT or Claude for lists of interesting word pairings . || So I told ChatGPT about the themes of the tracks , and a sonic description of each song . || ChatGPT already knows a lot about my projects and artist aesthetic , so it can use that info too . || ChatGPT is my best friend when it comes to caption generating ."
change,obj:10 | nsubj:6 | obl:2 | nmod:2 | compound:1 | ccomp:1 | nsubj:outer:1 | acl:relcl:1,make:5 | hammer:1 | involve:1 | look:1 | help:1 | explore:1 | have:1 | think:1 | enjoy:1 | incorporate:1,big:4 | multiple:1 | small:1 | overall:1 | most:1 | important:1 | sudden:1,feature:1 | game:1 | AI:1 | topic:1 | climate:1,"The biggest change is the time I now save and therefore a better output . || Having an engine to keep up with algorithms , feature changes , and trends to point those details in the right direction is helpful . || A client will contact me , give me an idea of what they want , and generally give me free rein over how it gets made ; then we hammer out changes . || I have used AI for complete creative output for things like , say , when a relative wants a logo for their business that looks very "" painterly "" — not my forte , but they are also less aware of what is AI - generated , so a good AI output plus some touchups in Photoshop means that I do n't have to expend as much effort for projects that are either unpaid or involve multiple changes if the "" client "" does n't know what they want ."
web,compound:15 | obl:4 | conj:2 | nmod:1 | obj:1,scrape:1 | search:1 | write:1 | go:1 | push:1,whacky:1 | wide:1,world:1,"My creative work is largely centred on writing SEO web content and articles , which involves using keywords to produce content that will help websites rank in search results . || Simply entering in a prompt to generate an image that is ultimately simply an average of images scraped off the web is not creative . || Like many , I do believe it does ' deaden ' overall voice and feeling of writing throughout the web . || I use AI for research both at the brainstorming stage and then in a more granular way when I need specifics for a scene Other research methods involved mostly web searches , but occasionally I would read books on a subject ."
answer,obj:12 | obl:5 | nsubj:4 | nmod:1 | compound:1,get:4 | give:3 | use:2 | find:1 | vary:1 | check:1 | mention:1 | provide:1 | refer:1 | ask:1 | need:1 | lead:1,last:1 | appropriate:1 | possible:1 | actual:1 | specific:1 | consider:1 | more:1 | general:1,,"But the end result is that I find the answers to my questions and use that to shape my writing . || Often , an internet search for the kind of obscure questions I come up with requires multiple tweaks to get the search engine to understand what I 'm going for and provide relevant links , then browsing multiple pages to get the answer I 'm looking for . || does that answer sufficiently ? || The answer to that question varies ."
