lemma,noun_roles_top,head_verbs_top,amod_top,compound_top,examples
AI,obj:447 | nsubj:360 | compound:277 | obl:129 | nmod:85 | iobj:55 | obl:agent:26 | nmod:poss:23 | nsubj:pass:23 | conj:20 | root:6 | obl:unmarked:6,use:331 | ask:43 | help:40 | generate:34 | have:33 | get:21 | make:20 | tell:19 | give:18 | take:18 | work:14 | create:14,generative:15 | current:2 | single:2 | creative:1 | early:1 | short:1 | enable:1 | smart:1 | different:1 | strategic:1 | visual:1 | careful:1,%:1 | work:1 | progress:1 | peruse:1 | processing:1 | Photoshop:1 | use:1 | bot:1 | image:1,"I use AI tools for brainstorming , asking quick questions about technique and theory , general admin , copywriting , emails / comms , and also business planning . || This was n't a client project but I 've been using AI to critically analyse film scores . || Basically I 've been asking AI to help write out an essay on something like the film Arrival and what made the score by Johannsson so unique . || I also am pretty concerned about how AI generated music might impact streaming platform saturation ."
idea,obj:226 | obl:98 | nmod:51 | conj:29 | nsubj:15 | compound:10 | root:4 | ccomp:3 | nsubj:outer:2 | appos:1 | obl:agent:1,come:41 | have:34 | give:27 | get:19 | brainstorm:16 | use:14 | bounce:13 | generate:13 | create:10 | provide:8 | take:7 | ask:5,general:8 | own:7 | creative:7 | original:7 | new:6 | clear:5 | initial:5 | good:5 | specific:4 | rough:4 | unique:4 | many:4,design:7 | brainstorming:6 | gift:3 | content:2 | theme:2 | painting:2 | name:2 | bundle:2 | character:2 | illustration:2 | song:1 | topic:1,Anyway — brainstorming is and ideation is really just a process of bouncing my ideas off a peer . || Just digging into broad topics and synthesising ideas . || Hopefully it 'll be able to help me refine my ideas and speed up my workflow . || Just getting a long list to try out over the instrumental often leads to finding a hook or at least a seed for a song idea .
time,obj:97 | nmod:77 | obl:69 | obl:unmarked:44 | compound:20 | nsubj:14 | root:13 | conj:11 | nsubj:pass:3 | nmod:unmarked:2 | nsubj:outer:1 | parataxis:1,save:27 | spend:22 | have:21 | take:16 | consume:7 | cut:7 | give:6 | be:5 | use:5 | free:4 | get:4 | think:4,more:19 | much:13 | less:9 | other:7 | same:4 | few:4 | many:4 | hard:3 | long:3 | own:2 | first:2 | free:2,research:2 | year:2 | travel:1 | planning:1 | prep:1 | turnaround:1 | bazillion:1,"I do n't know if these have actuated in the work yet but I imagine it 's only a matter of time . || Sometimes , when it comes time to add lyrics , I 'll ask ChatGPT or Claude for lists of interesting word pairings . || I probably spend less time brainstorming or procrastinating because it gets me started faster in that way . || I find myself increasingly reaching for AI tools , especially as time goes on and its capabilities continue to improve ."
work,obj:103 | nmod:97 | obl:65 | nsubj:28 | compound:11 | conj:11 | nsubj:pass:2 | root:2 | ccomp:2 | advcl:2 | appos:1,do:20 | use:11 | take:9 | create:7 | have:7 | focus:6 | change:5 | check:5 | make:5 | edit:4 | get:4 | see:4,creative:52 | own:7 | more:4 | write:4 | personal:3 | actual:3 | good:2 | much:2 | original:2 | mental:2 | low:2 | detailed:2,grunt:4 | design:3 | quality:3 | admin:3 | editing:2 | client:2 | drudge:1 | photography:1 | day:1 | illustration:1 | core:1 | writing:1,"I do n't know if these have actuated in the work yet but I imagine it 's only a matter of time . || My creative work is largely centred on writing SEO web content and articles , which involves using keywords to produce content that will help websites rank in search results . || I can see AI 's role continuing to grow larger as it continues to improve , saving further time and allowing for more work to be done than ever before . || They are very helpful for things like drafting memos or research into e.g. different eras of fashion for costume design , which frees up more time to focus on creative work ."
thing,obj:108 | obl:46 | nmod:41 | nsubj:17 | nsubj:outer:15 | root:13 | conj:9 | nsubj:pass:3 | appos:3 | parataxis:3 | xcomp:2 | ccomp:2,do:18 | create:8 | use:7 | come:5 | know:4 | see:4 | make:4 | keep:4 | look:4 | have:4 | try:3 | get:3,other:8 | new:7 | same:7 | good:5 | only:4 | different:4 | many:3 | whole:3 | specific:3 | few:2 | bad:2 | such:2,AI:1 | grunt:1 | work:1 | standalone:1,"The other thing that concerns me is how VOD streaming platforms might leverage AI tech along with their publishing libraries infinitely generate new music . || It 's kind of an "" ill know it when I hear it "" thing , so I just want it to throw lots of ideas at the wall . || One of the most concerning things I 've seen is new AI plugins that will assist you in the creative process by actually writing song parts . || I felt positive about the experience , as using AI helped me achieve a consistent tone and saved a lot of time from having to research things and write from scratch"
image,obj:117 | compound:44 | obl:40 | nmod:33 | conj:12 | nsubj:12 | nsubj:pass:2 | root:2 | parataxis:1,generate:25 | create:16 | use:13 | get:9 | have:6 | find:6 | upload:6 | give:5 | look:4 | base:4 | edit:4 | change:4,generate:6 | realistic:4 | good:2 | specific:2 | static:2 | amazing:2 | few:2 | dialectical:2 | original:2 | different:2 | strong:1 | produce:1,reference:4 | AI:4 | stock:4 | quality:3 | 2nd:2 | line:2 | product:2 | concept:2 | body:1 | listing:1 | business:1 | asset:1,"We 've also tried using it for things like generating graphics for internal comms like event invitations , but it did n't work too well for that - I have n't found an AI model that 's capable of producing a document with both coherent text and strong images together yet . || I think it would be the same for more truly creative tasks like graphic design as well , but it 's harder to get the necessary level of control over AI produced images than it is for text . || Brute forcing image generations can help with that , so I can at least begin to think , "" yes perhaps they would style their hair that way "" or the shape and color of their eyes . || While there is the counter - movement and support for artists who still work from hand , there are also people who simply want to be able to have an image ."
project,nsubj:69 | obl:65 | obj:44 | nmod:43 | compound:10 | nsubj:outer:7 | conj:4 | root:1 | obl:unmarked:1 | advcl:1 | ccomp:1 | iobj:1,work:12 | involve:10 | have:9 | do:8 | use:7 | start:6 | vary:5 | take:5 | complete:5 | include:4 | need:4 | make:3,typical:32 | recent:10 | creative:6 | different:5 | current:5 | other:4 | multiple:3 | big:3 | many:3 | more:2 | main:2 | small:2,writing:3 | 3d:2 | video:2 | client:1 | mixing:1 | map:1 | asset:1 | illustration:1 | craft:1 | crochet:1 | example:1 | fall:1,"Depending on the project I and scope I do everything from sound design to recording but my main skill is composing . || This was n't a client project but I 've been using AI to critically analyse film scores . || Many of my projects have been full productions - so , seeing the record through from demo to recording to mixing . || With an overseas move coming up though , I wo n't have the same access to my current home studio , so I 'm hoping to move towards doing more mixing projects , exclusively ."
person,nsubj:104 | nmod:39 | obl:32 | obj:26 | compound:11 | conj:7 | nmod:poss:6 | root:6 | advcl:3 | appos:3 | nsubj:pass:2 | obl:agent:2,have:9 | be:8 | use:8 | get:7 | see:5 | pay:5 | know:4 | want:4 | start:4 | make:3 | think:3 | come:3,many:11 | creative:5 | first:3 | most:3 | real:3 | less:3 | more:2 | talented:2 | other:2 | few:2 | third:2 | normal:1,camera:1 | jerk:1 | hunting:1 | purpose:1 | practice:1,"Planning so many classes each week takes so much time , which I do not get paid for ( I only get paid for in - person instruction ) . || This involves being across the entire filming process from start to finish , including hiring other creatives like camera people , costume designers , set designers , writers and editors . || A task like that is n't really creative , but I as the person using the tool to draft the letter would be in charge of the decisions on how it should be written , structured , etc . || I know people are concerned that it will take jobs away from freelancers eventually ."
writing,compound:63 | nmod:49 | obl:45 | obj:37 | nsubj:21 | conj:15 | appos:3 | ccomp:2 | parataxis:1 | acl:1,use:12 | do:9 | take:4 | put:2 | like:2 | think:2 | produce:2 | love:2 | learn:2 | have:2 | become:2 | need:2,creative:15 | original:4 | human:3 | professional:3 | actual:3 | good:2 | novel:2 | technical:2 | prompt:1 | own:1 | beautiful:1 | traditional:1,script:2 | blurb:2 | AI:2 | ghost:2 | copy:1 | business:1 | discovery:1 | media:1 | style:1 | message:1 | eBay:1 | listing:1,"They 're not currently advanced enough to be really useful for script writing , on screen graphic design , or other key creative elements . || Specifically the fields of editing and writing seem to be the most at risk . || Some of it is simple as editing , however , my main writing projects typically take the form of a choose - your - own - adventure gamebook . || That is to say , since I tend to world build in tandem with my writing ( and adjust for any potential additions ) using AI to generate "" moodboard "" pieces , or basic diagrams , can help me continue to the next step of my writing while having a simple foundation to draw upon ."
model,nsubj:72 | obj:51 | obl:29 | iobj:23 | nmod:23 | nsubj:pass:5 | conj:4 | obl:agent:3 | compound:3 | nmod:poss:2 | appos:1,use:25 | ask:18 | give:11 | have:5 | provide:5 | train:5 | get:4 | do:4 | try:4 | come:3 | work:3 | generate:3,different:5 | large:4 | generate:4 | multiple:3 | advanced:2 | free:2 | base:2 | few:2 | new:2 | intelligent:1 | various:1 | evaluative:1,AI:41 | image:6 | D:4 | text:3 | language:3 | generation:2 | hope:1 | frontier:1 | 3D:1 | 3d:1 | sale:1 | gen:1,"If I feel that the AI model is getting off track or giving me ideas that are far off from what I am envisioning , I will redirect the model or ask if we can start over . || We 've also tried using it for things like generating graphics for internal comms like event invitations , but it did n't work too well for that - I have n't found an AI model that 's capable of producing a document with both coherent text and strong images together yet . || Even using larger , more intelligent models , there 's rarely a point where I 've really felt like the AI is driving the creative decision - making . || The AI model might throw up some random things that could be relevant - for example , we both use vibrant red and orange hues in our paintings ."
process,obj:58 | obl:57 | nmod:44 | nsubj:25 | root:4 | conj:4 | acl:relcl:2 | xcomp:2 | nsubj:pass:1 | ccomp:1 | csubj:1 | obl:agent:1,make:12 | use:10 | enjoy:5 | go:5 | continue:5 | change:5 | involve:4 | start:4 | take:4 | help:4 | drive:3 | become:3,creative:34 | entire:6 | own:4 | actual:4 | same:3 | whole:2 | collaborative:2 | slow:1 | expensive:1 | artistic:1 | overall:1 | unique:1,writing:7 | editing:6 | design:5 | creation:4 | brainstorming:4 | thought:4 | development:2 | recording:2 | filming:1 | refinement:1 | thumbnail:1 | sketching:1,"Anyway — brainstorming is and ideation is really just a process of bouncing my ideas off a peer . || One of the most concerning things I 've seen is new AI plugins that will assist you in the creative process by actually writing song parts . || I am developing my own choreography style , which is a slow process . || This involves being across the entire filming process from start to finish , including hiring other creatives like camera people , costume designers , set designers , writers and editors ."
tool,obj:74 | obl:50 | nsubj:20 | nmod:18 | root:11 | conj:5 | nsubj:pass:4 | ccomp:4 | xcomp:3 | appos:2 | obl:agent:1 | advcl:1,use:53 | see:9 | have:5 | reach:4 | make:4 | be:4 | think:3 | become:3 | find:3 | rely:2 | ask:2 | give:2,useful:6 | more:4 | new:4 | many:4 | different:2 | special:2 | great:2 | helpful:2 | advanced:1 | mainstream:1 | integrate:1 | augment:1,AI:71 | editing:2 | audio:2 | efficiency:1 | reality:1 | productivity:1 | party:1 | search:1 | feedback:1 | engine:1 | organising:1 | Music:1,"I use AI tools for brainstorming , asking quick questions about technique and theory , general admin , copywriting , emails / comms , and also business planning . || Hopefully we see more advanced tools for technical tasks ! || I find myself increasingly reaching for AI tools , especially as time goes on and its capabilities continue to improve . || I use AI tools every week to help me build out the basic structure of my classes , including , but not limited to , barre warmups , stretching sessions , across the floor and center exercises , music choices , and integration of practiced steps into choreography ."
lot,obj:99 | obl:unmarked:30 | nsubj:30 | obl:14 | conj:4 | nsubj:pass:3 | nmod:3 | appos:2 | root:1 | parataxis:1 | ccomp:1,be:16 | spend:9 | have:9 | save:8 | take:8 | do:7 | require:7 | use:6 | help:6 | generate:5 | see:5 | write:4,whole:4 | -decent:1,,"I 'm honestly doing a lot my "" bucket filling "" ( that 's what a mentor calls it ) . || ChatGPT already knows a lot about my projects and artist aesthetic , so it can use that info too . || It 's kind of an "" ill know it when I hear it "" thing , so I just want it to throw lots of ideas at the wall . || Well the music production space ( even pre -AI ) has become flooded with a lot of snake oil software products ."
way,obl:78 | obj:38 | obl:unmarked:20 | nsubj:13 | conj:6 | root:6 | nmod:5 | nsubj:outer:2 | acl:1 | ccomp:1 | acl:relcl:1,use:16 | find:12 | be:6 | change:5 | feel:5 | work:5 | suggest:4 | come:4 | take:4 | have:3 | do:3 | write:3,different:8 | same:5 | new:4 | easy:4 | only:3 | other:3 | interesting:3 | fashioned:2 | unique:2 | good:2 | long:1 | unethical:1,,"I probably spend less time brainstorming or procrastinating because it gets me started faster in that way . || I think it still has a long way to go before it 's useful for generating visual content . || In my experience , I do n't find that chatbot going out of its way to provide that type of insight . || In a way , I tend to think of the story as a sort of AU ( Alternate - Universe ) interpretation of my main projects , and that lets me explore potential scenarios , plotlines , and character arcs from different angles ."
character,nmod:36 | compound:33 | obj:25 | conj:19 | obl:12 | nsubj:8 | nmod:poss:5 | appos:3 | xcomp:1 | advcl:1 | acl:relcl:1 | root:1,have:5 | say:3 | ask:2 | base:2 | play:2 | develop:2 | take:1 | incorporate:1 | distinguish:1 | represent:1 | distort:1 | find:1,main:8 | particular:2 | support:2 | popular:2 | various:1 | dimensional:1 | real:1 | consistent:1 | single:1 | unique:1 | non-player:1 | different:1,background:2 | side:1 | player:1 | Disney:1 | D:1 | D&D:1 | show:1,"Likewise , I may occasionally ask my AI to take on a particular character to have a conversation about them , and then compare its interpretations to how I * feel * they would genuinely act . || I do tend to collaboratively write with AI , asking it to assume the role of a dungeon - master or character ( s ) while feeding it quite a bit of lore . || In a way , I tend to think of the story as a sort of AU ( Alternate - Universe ) interpretation of my main projects , and that lets me explore potential scenarios , plotlines , and character arcs from different angles . || So for this in particular I was asking the AI to assume the role of various characters , each with their own unique goals , each one of them a moving part in this little microcosm ."
design,compound:43 | obj:36 | conj:24 | nmod:19 | obl:17 | nsubj:4 | root:1 | xcomp:1,use:4 | make:4 | plan:3 | sketch:3 | put:3 | come:3 | take:2 | create:2 | have:2 | tell:2 | do:2 | refine:1,graphic:10 | human:2 | several:2 | mock:1 | basic:1 | ethical:1 | multiple:1 | flesh:1 | different:1 | similar:1 | set:1 | popular:1,sound:4 | game:3 | cover:3 | logo:3 | board:2 | shoe:2 | web:2 | screen:1 | costume:1 | 2nd:1 | token:1 | learning:1,"Depending on the project I and scope I do everything from sound design to recording but my main skill is composing . || They 're not currently advanced enough to be really useful for script writing , on screen graphic design , or other key creative elements . || They are very helpful for things like drafting memos or research into e.g. different eras of fashion for costume design , which frees up more time to focus on creative work . || I think it would be the same for more truly creative tasks like graphic design as well , but it 's harder to get the necessary level of control over AI produced images than it is for text ."
story,obj:44 | obl:31 | nmod:25 | compound:14 | conj:10 | nsubj:9 | nsubj:pass:2 | nmod:poss:2 | root:2 | parataxis:1 | appos:1,write:16 | create:4 | tell:4 | go:4 | give:2 | round:2 | explore:2 | do:2 | build:2 | work:2 | read:2 | make:2,short:14 | own:3 | whole:3 | entire:2 | meaningful:1 | impactful:1 | write:1 | stimulate:1 | related:1 | seamless:1 | actual:1 | base:1,AI:2 | writing:1 | fiction:1 | micro-:1 | horror:1 | background:1 | sci:1 | love:1 | freeform:1 | fantasy:1 | alien:1,"It also does n't have lived human experience to draw on to create meaningful , emotionally impactful stories . || In a way , I tend to think of the story as a sort of AU ( Alternate - Universe ) interpretation of my main projects , and that lets me explore potential scenarios , plotlines , and character arcs from different angles . || Up to now it 's been flash fiction and short stories , and I 've won awards for some of them . || In the field in general , I 'm super concerned about the use of AI to write stories and design book covers ."
example,obl:95 | nmod:15 | obj:10 | nsubj:7 | compound:4 | root:3 | nsubj:outer:1 | conj:1,have:13 | use:10 | ask:9 | give:8 | say:4 | be:4 | provide:3 | come:2 | write:2 | help:2 | discuss:2 | get:2,previous:1 | recent:1 | real:1 | above:1 | different:1 | specific:1 | perfect:1 | practical:1 | other:1 | friendly:1,world:2 | desk:1 | textbook:1 | character:1,"So for example - when songwriting , I 'm usually more instrument - first . || For example , I have an EP 's worth ( 4 tracks ) of instrumental electronic music . || For example , I can ask AI to make the combination more difficult or I can ask it to add more content / time to the across the floor section of class and take it away from the barre section . || Sometimes I have a very specific vibe of a character , yet because of my aphantasia , it can be hard for me to truly visualize them without an example of sorts ."
video,compound:42 | conj:23 | obj:20 | obl:20 | nmod:12 | nsubj:10 | root:4 | parataxis:1 | nsubj:pass:1 | appos:1,use:4 | make:3 | create:3 | generate:3 | do:2 | work:2 | get:2 | edit:2 | add:2 | have:2 | read:1 | need:1,own:3 | promotional:2 | generate:2 | recent:1 | short:1 | good:1 | blow:1 | photorealistic:1 | non-realistic:1 | base:1 | multiple:1 | exaggerate:1,music:4 | YouTube:3 | AI:3 | TikTok:2 | client:2 | promo:2 | form:1 | game:1 | ad:1 | trailer:1 | read:1 | editing:1,"That means I write music for film , tv , video artwork , installations , etc . || I came to this job with literally no prior knowledge besides having some of my own videos on TikTok go viral . || I find in my experience AI does n't pick up on the trends fast enough to make meaningful video ideas . || Most recently , I made a video targeted towards beginners ."
art,obj:34 | compound:30 | obl:21 | nmod:17 | nsubj:11 | conj:6 | xcomp:2 | advcl:2 | appos:2 | nsubj:pass:2 | root:1 | ccomp:1,make:11 | create:8 | use:6 | come:3 | do:3 | take:2 | see:2 | reproduce:2 | like:2 | value:2 | have:2 | become:1,true:4 | generate:4 | real:3 | human:3 | visual:3 | make:2 | more:2 | digital:2 | base:1 | fine:1 | prove:1 | martial:1,concept:7 | AI:5 | placeholder:2 | textile:2 | installation:1 | stage:1 | circus:1 | stock:1,"This is ok for finding a vibe , but again , I think taking * creative * direction from it is a mistake , because it robs the human creativity element that makes art interesting . || Dance is an art form that has been practiced since the dawn of time . || I would hate to see a time where the art of dance becomes too uniform or "" cookie cutter "" due to the influence and use of AI . || Likewise , as a result , I sometimes end up creating supplementary graphics , concept art , etc , while worldbuilding ."
research,obj:33 | obl:29 | compound:25 | conj:15 | nmod:13 | nsubj:11 | root:2 | appos:1,do:17 | use:8 | help:6 | focus:2 | make:2 | save:2 | assist:1 | rely:1 | involve:1 | start:1 | work:1 | kickstart:1,own:5 | deep:4 | extensive:2 | write:1 | visual:1 | more:1 | online:1 | archival:1 | preparatory:1 | further:1 | foundational:1 | actual:1,AI:3 | market:2 | art:1 | pre-writing:1 | writing:1 | state:1 | competitor:1 | material:1,"They are very helpful for things like drafting memos or research into e.g. different eras of fashion for costume design , which frees up more time to focus on creative work . || I do think that overall , AI will get * better * at the things that I 'm already using it to do — brainstorming , research , editing — and that will be a boon overall . || I also use AI to assist in my written visual arts research , and in crafting artist statements for exhibitions . || It involves brainstorming , research , and lots of editing ."
content,obj:43 | nmod:28 | compound:18 | obl:14 | conj:13 | nsubj:8 | nsubj:pass:3 | appos:1,create:16 | write:6 | generate:3 | work:3 | produce:2 | use:2 | get:2 | want:2 | copy:1 | undergoe:1 | add:1 | prepare:1,write:4 | other:4 | more:3 | generate:2 | cheap:2 | creative:2 | initial:1 | polished:1 | professional:1 | terrible:1 | low:1 | visual:1,video:4 | AI:3 | seo:2 | website:2 | media:2 | Instagram:2 | web:1 | quality:1 | filler:1 | stream:1 | training:1 | editing:1,"My creative work is largely centred on writing SEO web content and articles , which involves using keywords to produce content that will help websites rank in search results . || A typical project for me is a content request from a project manager , which will be for a specific client and requires a certain number of pages of content to be written . || I use it for everything from brainstorming topic ideas and page outlines through to feeding it prompts to generate content . || I also occasionally use it for proofreading and fact checking by copying in written content to check it ."
book,obj:50 | nmod:22 | obl:21 | compound:15 | conj:8 | nsubj:5 | root:2 | parataxis:1 | appos:1,write:15 | use:5 | churn:4 | read:3 | have:3 | want:3 | make:3 | finish:2 | sell:2 | produce:2 | illustrate:1 | drag:1,publish:3 | few:2 | physical:2 | other:2 | current:2 | whole:2 | more:2 | write:2 | own:2 | successful:2 | first:2 | unpublished:1,picture:3 | history:2 | activity:2 | coloring:2 | design:1 | author:1 | AI:1 | form:1 | fit:1 | writing:1 | horror:1 | reference:1,"Currently I 'm working on illustrating two different children 's books . || Another project I used it for was to help design a book cover layout that I was pressed for time to illustrate . || In the field in general , I 'm super concerned about the use of AI to write stories and design book covers . || But it wo n't have the deeper nuances that only a human can weave throughout the story - the slow burn emotional response a reader might feel from reading a book by an accomplished author ."
question,obj:60 | root:16 | obl:11 | nsubj:7 | conj:4 | nmod:4 | parataxis:3 | ccomp:2 | nsubj:pass:1 | dislocated:1 | iobj:1,ask:26 | have:20 | answer:13 | let:4 | sound:3 | begin:3 | think:2 | include:1 | find:1 | claude:1 | follow:1 | understand:1,quick:2 | difficult:2 | more:2 | precise:2 | obscure:1 | multiple:1 | first:1 | several:1 | specific:1 | base:1 | other:1 | last:1,troubleshooting:1 | workflow:1 | choice:1 | follow:1 | biology:1 | Chat:1 | gpt:1 | knitting:1 | roundabout:1,"I think I 'm good for questions . || I use AI tools for brainstorming , asking quick questions about technique and theory , general admin , copywriting , emails / comms , and also business planning . || I 'm using it mostly for brainstorming out of creative blocks , and for troubleshooting or techy workflow questions . || I do n't have any questions"
writer,root:18 | nsubj:15 | obj:13 | obl:13 | conj:9 | nmod:poss:9 | nmod:8 | xcomp:5 | acl:relcl:2 | nsubj:pass:2 | advcl:1 | compound:1,use:4 | make:3 | block:2 | need:2 | pay:2 | replace:2 | write:2 | employ:1 | bounce:1 | pride:1 | require:1 | suppose:1,good:6 | human:5 | creative:3 | freelance:3 | most:2 | many:2 | talented:1 | great:1 | terrible:1 | idiosyncratic:1 | indie:1 | other:1,content:2 | ghost:1 | assistant:1 | minority:1 | blog:1 | TV:1 | copy:1 | non-fiction:1 | level:1 | hobbyist:1,"I also manage a small team of writers and need to regularly give updates to my manager . || This involves being across the entire filming process from start to finish , including hiring other creatives like camera people , costume designers , set designers , writers and editors . || I 'm an artist and a writer with a PhD in Visual Arts . || One thing I will never use AI for is getting it to write or re-write a section of text for me as that 's no better than employing a ghost writer and I 'd feel a fraud ."
